5993020a5f49420001caf86b,51,2,8,,4,6,6,7,6,6,6,6,4,6,6,5,1,1,4,2,3,2,4,1,2,1,7,2,3,1,4,7,6,1,1,1,1,1,1,1,1,3,1,3,2,4,4,1,3,3,6,2,1,2,1,Run a 5k,reach weight goal,become stronger,write a children's book,paint a masterpiece,5,6,6,5,7,3 months,3 months,3 months,1 year,20 years,6,6,6,4,5,7,7,7,6,7,7,7,7,7,7,1,I showed at my first art gallery,"I found a life partner, spouse",I lived with a Weimaraner,100,100,100,7,7,7,7,7,7,I changed my beliefs,I talked about the news with family,I took a stand,81,75,91,6,6,7,5,6,7
55a28851fdf99b602e6b05dd,68,2,9,0,10,5,5,5,7,6,6,7,4,6,4,2,2,4,5,1,1,1,1,1,1,1,7,7,7,7,7,7,7,7,6,4,4,4,4,7,1,1,7,7,7,7,1,6,7,1,4,7,1,4,1,lose 20 lbs,remain independent,follow a healthy diet,recycle or re-use everything,spend as much time as possible with family,5,7,6,6,7,one year ,all my adult life,5 years,20 years,40 years,5,5,6,6,6,7,6,7,6,6,7,6,7,6,6,1,ate out for the first time since March,took out all of the recycling,the last family member of my parents' generation died at the age of 92,100,50,0,4,4,7,5,1,7,watched the vice-presidential debate,watched the presidential candidates debate,voted,50,22,100,4,4,7,4,4,7
5d60b5beea1c1c0001c98bf6,63,2,8,50,2,5,7,5,7,7,7,7,5,7,5,1,1,1,1,1,1,1,2,1,1,1,1,1,1,1,1,1,1,1,1,1,1,1,1,1,1,1,1,1,1,7,5,1,1,1,1,1,1,1,1,to retire,to live in the moment,to travel more,to be heathier,to get to my goal weight and maintain it,7,7,7,7,7,,,,,,1,3,2,4,1,7,6,7,7,5,7,7,7,7,5,1,my birthday,I went to the beach,I went bike riding,100,100,100,7,4,4,7,7,7,I requested my absentee ballot,I read some of Trump's tweets about voting,I received mail about voting for Biden,50,0,50,7,1,1,7,4,6
5be8d4af25507300010dd4e4,47,2,4,61,9,3,5,4,5,4,6,6,2,6,3,2,2,3,2,4,2,1,3,2,3,1,3,3,3,1,1,2,5,7,4,5,6,5,5,7,5,2,2,2,2,4,6,6,1,3,6,2,2,1,1,TO work again,to quit smoking,to get in shape,,,5,7,6,,,3 months,12 months,2 months,,,1,6,5,,,4,7,6,,,5,7,7,,,3,went to doctor,went to therapist,rode bike again,51,72,92,6,6,5,7,7,6,Trump got Covid,Presidental debate,Trump Rallies,2,34,90,7,5,6,7,6,6
5af5262f1b55800001f4a418,46,2,4,18,8,4,5,4,6,5,6,6,4,6,5,3,1,2,4,2,2,2,2,2,3,2,6,5,6,5,4,4,6,5,6,5,5,6,6,7,4,6,5,5,5,4,6,6,6,5,5,5,6,5,1,keep losing weight,using time more wisely,continue to be a non-smoker,,,7,6,7,,,1 year,2 months,6 months,,,5,6,6,,,7,7,7,,,7,7,7,,,1,My dog has been sick,I breathed toxic cleaner fumes ; hurt my lungs,doing some renovations in kitchen,0,1,70,7,7,6,7,7,7,Friend and I watched the Presidential debate,A friend who is a big Trump supporter has had a change of heart,friend and I watched the Vice Presidential debate,47,95,49,6,6,6,7,7,6
5c628464519bc50001cc09b3,48,1,10,50,9,4,7,7,7,7,7,7,1,7,7,1,1,4,1,1,1,1,1,1,1,1,4,2,3,4,7,1,7,1,1,1,1,1,1,1,1,1,7,2,1,7,4,1,2,1,7,1,7,4,1,Getting a bachelors degree,Changing careers,Getting married,Having a family,Going on a trip far away,7,7,7,7,7,5 Years,1 year,2 Years,1 Year,10 years,1,7,1,1,7,7,7,1,1,7,7,7,1,1,7,1,Worked from home,,,100,,,7,,,7,,,Marked my voting ballot,,,100,,,7,,,7,,
5d02e02a2c5da00001474340,44,2,6,40,8,4,4,6,6,5,5,6,2,6,4,1,1,3,4,2,3,1,1,1,1,1,4,4,2,1,3,1,6,1,1,1,5,1,1,1,4,5,1,3,4,7,4,1,1,1,5,1,6,4,1,pay off car,Pay off loans,pay off credit card,buy a house ,lose weight,7,7,7,4,4,5 years,1 year,2 years,10 years,forever,7,4,4,1,1,7,7,7,4,3,7,7,7,5,4,1,kid restarted school,worked lots of overtime,bought a trombone for kid ,83,18,58,7,6,5,5,3,6,I voted by mail,talk politics with sister,tired of watching news because of current president,100,43,0,7,5,6,7,4,5
5c5da579bfe5280001448433,60,2,10,78,3,7,5,5,7,6,6,7,6,7,5,4,1,1,1,1,1,1,1,1,1,1,4,6,3,3,7,4,1,1,1,1,1,1,1,1,1,4,1,1,1,7,5,1,1,4,4,1,4,4,1,Lose weight,exercise more,travel,remain financially stable,be a grand parent,7,7,7,7,7,forever,2 years,2 years,1 year,not yet until daughters are married,4,7,4,4,1,7,7,7,7,4,7,7,7,7,7,1,3 week cross country trip,weekend camping trip,family gathering,100,100,100,7,7,7,7,7,7,requested absentee ballot,watch 1st presidential debate,watch closing remarks of vice presidential debate,50,50,50,7,2,2,7,7,7
5aecad0e75deca000162634c,63,2,7,15,8,2,6,6,7,7,6,6,3,7,1,1,1,1,1,1,1,1,1,1,1,1,6,1,6,3,1,2,7,1,7,3,7,6,1,1,1,5,7,6,1,6,1,1,1,3,7,7,4,3,1,write a book,write greeting cards,get a couch,get a puppy,remain stable,5,5,6,6,7,4 years,20 years,1 year,6 months,40 years,2,2,2,2,6,6,6,6,7,7,7,6,7,7,7,1,racial injustics,uptick in corona virus,rittnhouse not being charged in killing 2 people,0,0,0,7,6,6,7,6,7,he refused to help California wildfires,he got corona virus,he  reintroduced redlining,0,27,0,7,5,7,7,2,7
5bd45c509afb5b00015c48f4,67,2,10,100,10,3,7,5,7,7,5,7,1,7,4,1,2,1,4,1,1,1,1,1,1,4,7,4,5,1,7,7,4,7,7,7,7,7,7,7,7,7,7,4,4,7,7,7,7,7,4,4,4,1,1,Pay off debt,save for daughter's wedding,organize at home,make repairs at home,have a substantial savings,7,7,7,7,7,5 years,1 year,2 years,3 years,8 years,1,6,6,5,3,6,7,7,6,4,7,7,6,7,6,1,my cousin's cancer worsened,my daughter became engaged,covid cases going down in my state,0,100,87,7,7,7,7,7,7,I found out that I can vote early in a school across the street,I watched the presidential debate,I watched the vice presidential debate,100,64,75,6,5,5,7,7,7
5a2732ceb51a74000132da85,28,2,5,5,6,2,5,5,5,4,4,4,2,6,2,3,3,3,1,3,2,1,2,1,1,2,4,1,6,2,1,1,3,1,2,1,1,3,1,1,1,1,2,2,1,1,1,1,2,2,1,1,3,1,1,Be in a better financial situation,Get a better job,overcome depression and anxiety,perform music publically,,6,5,7,5,,5 years,5 years,15 years,2 years,,3,1,1,1,,4,5,4,4,,5,6,5,5,,1,debt exceeded 50% of my available credit,saw a friend I hadn't seen in a while,started playing video games again,5,91,72,7,6,4,7,6,5,watched the first debate,decided to only get my news from allsides.com,made a plan for how to fill out my ballot,18,88,50,3,5,7,7,4,5
5d1e2045a37a4d001a1fc2cb,21,1,6,40,2,4,6,7,7,6,7,7,2,7,5,1,3,1,3,1,7,5,2,4,1,2,4,1,1,4,1,1,1,1,1,1,1,5,1,1,3,4,5,1,4,1,2,1,1,4,2,1,1,1,1,Graduating From college,Having a nice job,Staying Healthy,Being Mentally Well,Being fiancially secured,7,7,7,7,7,2 years,1 year,3 years,3 years,5 years,5,4,7,7,5,7,7,7,7,7,7,7,7,7,7,2,Started a new semester in college,Praticing Driving,Making money,80,61,100,7,7,7,7,7,7,Watched Movies,Watched Tv shows,Trading,100,100,71,7,7,5,4,5,3
55d7e6f669dbc30012b6826e,64,2,8,66,6,2,5,3,7,6,6,6,3,6,4,2,2,4,2,3,3,2,3,3,2,2,3,4,6,6,3,5,4,6,7,5,6,5,7,4,3,4,2,5,6,7,5,5,5,5,7,4,2,3,1,move to another city,pay off my house,loose weight,fix my car,sell my house,5,6,6,6,5,2 yrs,30 yrs,6 yrs,3 months,1 yr,3,5,4,7,3,6,6,7,7,5,6,7,6,7,7,3,husband died,mother got sicker,car broke,0,0,0,6,7,6,7,7,7,voted by mail,decided to vote for Biden,dislike trump more,100,83,1,7,7,6,6,7,6
5b6a87d2cda8590001db8e07,40,2,3,2,4,5,5,5,7,6,6,6,1,7,6,1,2,3,3,1,1,2,1,2,2,3,5,7,7,5,2,5,6,7,7,5,6,6,7,7,2,2,5,6,4,1,1,2,3,5,6,5,6,5,3,Be happy,Have a family,Live in a house,Do new things,Have new experiences,6,7,6,5,5,6 years,7 years,13 years,1 year,1 year,2,1,1,2,2,2,2,1,3,3,5,6,6,7,7,5,I paid my bills successfully.,I bought workout clothes I needed.,I reduced the amount of spam mail I get.,100,90,84,7,5,5,6,5,3,I received a mail in ballot.,I watched TV coverage about the election.,I read social media opinions on what is going on.,100,56,78,7,3,5,6,3,3
5c0f1cf4f3027300014b606f,38,1,7,60,7,5,6,6,5,4,6,4,3,5,3,3,3,3,3,4,5,5,4,3,4,1,1,2,4,2,1,1,2,4,5,1,5,5,4,1,4,3,2,2,3,3,3,3,3,3,1,4,1,3,1,financial security,international travel,physical fitness,spiritual wellbeing,skill acquisition,6,5,6,5,4,last few years in earnest,lifelong,"lifelong, but recently renewed",past two years in earnest,with recent cause,2,1,3,2,5,2,2,5,3,6,5,6,5,4,7,2,medical concern,work challenges,financial concerns,0,65,25,7,6,5,7,4,6,1st Debate,VP debate,Townhalls,50,50,50,4,4,4,4,4,2
5b33a01fa8327d0001003821,67,2,7,50,1,5,4,6,6,6,7,7,5,7,6,3,1,4,1,1,1,1,1,1,1,1,1,1,4,1,1,4,5,1,1,1,1,1,1,1,4,4,4,2,4,7,5,1,1,4,4,4,1,1,1,get my screenplay made into a movie,lose 5 pounds,eat healthier,get my children's books published,exercise more,5,5,7,7,7,1 year,1 week,1 year,5 years,6 months,1,7,5,2,5,2,5,5,2,5,1,6,5,2,4,2,got new eyeglasses,had sore throat and stuffy ears,had to get a new refrigerator,100,0,100,7,7,7,7,7,7,none,none,none,50,50,50,4,4,4,4,4,4
5c19a630257db80001a2b3a8,64,1,7,92,9,5,6,6,6,6,6,7,5,6,5,2,2,2,2,3,3,1,4,2,3,1,6,7,7,1,6,1,1,1,7,2,1,2,1,1,7,7,5,2,7,7,7,1,1,7,1,6,1,1,1,retire,more money,get a new car,lose weight,be happy,7,7,7,7,7,20,10,1,5,20,6,5,5,4,5,6,6,5,6,5,6,5,6,5,6,1,was in an auto accident,looking for a new car,slept in late,0,59,67,7,6,5,7,7,6,watch hannity,listen to rush,watch the debates,99,100,87,7,7,7,7,7,7
5df97cf6deea2b70989b6528,49,2,4,10,3,5,5,4,7,7,5,6,4,7,7,1,1,3,2,3,1,1,1,1,1,1,6,5,4,3,4,7,5,7,7,5,6,7,7,7,1,1,1,2,7,3,1,1,1,1,7,1,1,1,1,pay off debt,make fun memories,paint the house,get better health insurance,be more active,7,6,4,5,5,20 years,10 years,1 year,2 years,1 year,1,2,1,4,4,1,5,3,5,4,3,6,7,5,4,1,Got a haircut.,Had lunch at an outdoor restaurant.,Organized my closet. ,85,100,90,4,5,4,1,2,4,Looked over my absentee ballot.,Saw information about the debate online.,Got my absentee ballot in the mail.,50,10,90,5,1,7,1,1,1
586372cae16d530001b345b8,63,2,2,50,5,6,1,7,7,7,6,6,4,7,5,1,1,6,1,1,1,6,7,1,1,3,5,1,1,4,6,1,7,1,1,1,1,1,1,1,5,5,6,6,6,6,7,1,1,6,6,1,5,6,2,"Health- Overcome the issue in my right leg causing me to have my leg go out from under me, as well as being able to get off chairs, commode, etc. ",Check deeper into microinvesting- particularly precious metals,Weight loss,Better health,Better income,7,7,7,7,7,one week due to recentness of health issue,1 month,7 months,`1 year,1 year,7,7,4,5,5,7,7,5,4,5,7,7,5,6,5,3,"Fell five days ago hurting the right hand side of my groin, hip, and had pain into my knee.  Am now even having to use a walker which is quite stressful. ","I and my significant other became involved with an animal welfare organization here as fosters for ferral cats during a Trap and Release program for spay/neuter and medical that our city, and the Animal Welfare Society have started. ",We have a young neighbor whom we have discovered is very questionable that lives in the next building of our apartment complex. ,0,100,0,6,7,1,7,7,6,I and my significant other obtained our absentee ballots and voted by mail. ,Joe Biden announced candidacy for president.  ,Kamala Harris was selected as a running mate. ,100,0,0,7,1,1,7,7,7
5c3d4b92486a390001e87dfe,57,2,8,60,10,5,7,6,7,6,7,7,5,7,5,2,1,1,5,1,1,5,1,1,3,1,7,7,6,3,1,2,3,7,6,3,7,6,7,7,5,2,5,6,5,6,4,4,5,6,7,5,5,7,1,Complete family visit,Finish all work successfully by end of year,Buy a new car,Buy a vacation house near family,Diet and Exercise,6,6,2,3,6,Since cancellations in March - 7 monts,"New fleet of projects came up this month, all with that due date",2 years,1 year,1 year,7,7,2,1,6,7,7,4,6,7,7,7,7,6,6,2,lingering illness in family,obtaining loads of new work,change in vacation plan,28,100,36,6,5,2,7,6,3,grimacing my way through Debate 1,Placing votes,whiplash through watching two town halls at once,41,80,42,1,7,1,7,7,7
5df97abeabec5d6fcbbc764d,68,2,8,15,1,3,7,3,7,7,7,7,3,7,6,1,1,1,1,1,2,1,1,1,1,1,4,4,1,4,7,7,7,7,7,7,7,6,7,7,5,7,7,6,5,6,7,7,7,7,7,6,4,4,1,Stay close to my daughter emotionally and physical,Be as financially secure as possible,Stay as healthy as possible,To see the Royals win another World Series,To learn to play the harmonica reasonably well,7,7,7,5,4,22 years,14 years,"25 years, on and off",since we last won (2015),"six years, off and on (mostly off)",7,7,5,1,4,7,7,4,6,6,7,7,6,7,6,1,I had surgery four days ago (hence I'm a bit grumpy).,Have gotten help from daughter due to surgery,Learned that favorite harmonica player has to have surgery in about a week,25,100,5,6,7,7,7,7,7,Facebook friend constantly posts political crap,Worry about my daughter's future,President Moron said or did something moronic (no sense singling out which thing... there are too many of them),25,0,100,3,7,7,7,7,7
5dd0098e01fadf0fa6c3a15f,35,2,5,25,3,4,6,4,5,5,4,4,2,5,4,3,3,2,4,6,4,4,2,5,5,2,5,2,2,2,2,4,6,1,1,1,2,1,1,1,1,2,1,2,3,4,1,1,1,1,5,1,5,3,1,Travel to Patagonia,Visit each National Park in the US,Increase my fitness,Eat more veggies,Hike the Pacific Coast Trail,5,6,6,6,4,3 yrs,5 yrs,1 yr,6 months,2 yrs,1,1,6,6,1,3,2,7,7,4,6,6,7,7,5,1,My friends father passed away from covid,I injured my wrist and ankle,My friend had a health scare,19,9,22,4,5,5,7,7,6,I voted,I watched the 1st presidential debate,I watched the VP debate,82,5,22,7,5,3,7,7,2
5b6f49b7d60bdd0001ade437,65,1,9,61,6,4,5,4,7,7,7,6,4,7,6,1,1,5,1,1,2,1,1,2,2,1,1,1,1,1,1,1,1,1,1,1,1,1,1,1,4,1,1,1,1,7,1,1,1,1,1,1,1,1,1,Retire,Travel,Get new car,Raise children,get grandchildren,7,7,5,7,7,40 years,30 years,1 year,15 years,15 years,1,1,7,1,1,6,7,7,7,1,7,7,7,7,6,1,Son playing lacrosse,Kids start school again,Going to trailer in country,100,100,100,7,7,7,7,7,7,watch debate,saw campaign signs,Listen to them rant on TV,61,0,8,2,1,1,7,7,4
5a94d24fb5e2110001c689b5,59,2,8,96,5,1,6,1,5,6,7,7,4,5,1,1,1,5,1,1,3,1,5,4,1,5,2,2,2,2,2,2,2,2,2,2,2,2,2,2,2,2,2,2,2,6,2,2,2,2,2,2,2,2,1,loving relationship,introducing people to Jesus Christ,cleaning house,caring for mother,spending time with dying sister,6,7,6,6,6,3 weeks,15 years,30 years,5 years,2 days,4,5,5,5,5,5,6,5,5,5,3,3,3,3,3,5,caring for my mom,praying,reading Bible,100,100,100,7,7,7,7,7,7,watching rally,praying,learning about candidates,54,100,53,3,7,4,3,7,3
579e1e2b275be6000135af15,44,1,2,0,9,4,6,7,7,1,7,7,1,7,3,5,1,2,3,3,6,3,4,1,4,2,7,1,1,1,1,1,7,7,7,1,7,7,7,7,1,1,1,7,1,1,1,1,1,7,1,1,7,7,1,get married,improve mental health,return to work,live in a house instead of apartment,get an xbox series x,7,7,6,6,5,1 year,most of my life,4 years,10 years,a few months,7,2,1,1,7,7,4,4,4,7,7,4,4,4,7,1,neighbors were evicted,son returned to school,went to a funeral,100,50,0,7,5,4,7,7,7,began avoiding old friends,stopped talking to my parents,keep getting stupid unwanted texts,0,0,50,7,7,1,7,7,1
5bf08e67d63d690001360a79,,,,24,8,1,6,4,6,6,5,6,4,5,3,1,1,1,1,1,1,1,2,1,1,2,4,1,1,4,1,1,7,1,1,1,1,1,1,1,4,4,6,5,1,6,1,1,1,1,1,4,6,1,1,Feeling better physically,Fixing my house,Putting a new roof on my house,Taking care of my grandsons,Finishing a degree,5,6,6,7,6,19,5,5,3,10,2,2,2,7,1,4,6,6,4,5,1,7,7,7,5,1,So sick with UTI that I can't take a flu shot yet.,Getting my mother an early birthday present.,Taking care of grandsons.,0,100,100,1,7,7,7,5,7,Telling my cousin when early voting starts.,Telling my mother what Trump is doing that he shouldn't be.,Telling my grandson we are voting on Monday.,100,50,89,7,7,7,6,6,6
5dcc948ed9873592337ae827,,,,82,9,5,6,5,6,6,6,6,6,6,6,1,1,1,5,1,1,1,1,1,1,1,7,4,,1,7,1,1,1,1,1,1,1,1,1,5,7,,6,5,7,7,1,1,4,4,4,,7,1,save for retirement,travel more,spend more time with family,retire to warm area,volunteer more,7,7,7,7,7,10,5,10,5,10,5,3,5,1,5,6,6,6,6,6,7,7,7,7,7,1,Had home for sale and could not sell so just took it off market,adult daughter just lost job,refinished portions of kitchen,0,0,82,7,7,6,7,7,7,Someone stole out Trump sign in the yard,I don't talk politics with my spouse anymore,I talk about politics more with my daughter,29,50,100,3,7,7,7,7,7
5d02b1ce6c69cf00162f5f1a,,,,,,,,,,,,,,,,,,,,,,,,,,,,,,,,,,,,,,,,,,,,,,,,,,,,,,,,,,,,,,,,,,,,,,,,,,,,,,,,,,,,,,,,,,,,,,,,,,,,,,,,,,,,,,
5d92832f82e59d001a0e7f1b,53,2,10,39,9,5,6,5,6,7,6,6,4,6,7,2,1,5,3,4,2,1,1,1,1,2,5,7,4,1,5,1,2,7,1,3,1,2,1,7,7,7,4,3,7,7,6,1,1,5,6,1,1,3,1,live frugal,do 10 pull ups,save money,lead with a grateful heart,reach out to friends & family,7,6,7,7,7,10 years,1 year,forever,2 years,1 year,7,6,7,6,7,7,7,7,7,,7,7,7,7,7,1,working,back to the gym,got a raise,100,100,100,7,7,4,7,7,7,filled out my balot,watched a town hall,paid attention to what is going on with the election,90,78,86,7,7,7,7,7,7
5dc37cc0380a67285572a9b3,,,,20,7,1,3,6,5,6,6,6,2,6,6,2,2,6,2,1,7,2,2,1,6,1,7,7,1,3,1,1,7,2,1,2,7,3,2,1,7,1,1,7,1,4,1,7,7,1,6,2,5,7,1,Be able to afford health insurance,One day actually own a home,Have no credit card debt to survive,Actually make $15 an hour,Not want to kill myself from depression,7,7,7,7,7,5 years,5 years ,5 years ,8 years,26 years ,1,1,1,1,1,1,1,1,1,1,2,1,1,2,1,1,Couldn’t afford rent,Car accident,Surgery,0,0,0,7,7,7,7,7,7,Arguments,Division,Robocalls,0,0,0,1,1,1,5,6,6
5dbdf54d13d4c7320ab224f7,,,,,,,,,,,,,,,,,,,,,,,,,,,,,,,,,,,,,,,,,,,,,,,,,,,,,,,,,,,,,,,,,,,,,,,,,,,,,,,,,,,,,,,,,,,,,,,,,,,,,,,,,,,,,,
5c817d90fae0130015ce9bda,,,,50,1,6,6,6,7,7,6,7,7,7,7,1,1,5,1,1,1,1,1,1,1,1,7,7,4,7,6,5,7,7,7,3,7,5,4,5,3,7,6,7,7,7,5,7,7,3,1,7,7,2,1,Go to see Wimbledon ,Go to Europe ,See the Grand Canyon,See Smithsonian museums,Attend The French Open,5,7,7,7,5,5 years ,15 years ,35 years ,35 years ,5 years ,1,1,1,1,1,1,2,2,2,1,1,5,7,7,2,1,My son was told he needs surgery on his hand,My husband possibly got a better position at his job,My father fell and has needed more assistance ,0,87,0,7,7,7,7,7,7,"Irritation, DAILY",the endless political mail is making my husband’s job even more unbearable ,The political phone calls are driving me crazy ,0,0,0,6,7,6,7,7,7
5d100514de34c40016972f5b,27,2,8,0,7,6,6,6,5,6,6,6,7,6,7,4,1,1,6,5,1,3,6,2,2,2,3,1,1,6,1,1,5,1,1,6,7,1,1,1,1,1,6,5,4,2,2,4,5,3,7,6,7,6,1,Get another story published,Purchase a rug,Go on vacation,Finish another story,Do my job well,5,2,5,5,6,1 year,1 month,1.5 years,6 months,4 months,1,5,2,5,6,6,7,4,7,7,7,7,7,7,7,3,Board networking event,Movie night,Sister's birthday,80,98,56,5,5,6,6,3,5,Watched the debate,Voted,Went to a notary ,25,75,92,2,7,7,7,6,7
5ddcd77f23f9f1c2c45d6c18,,,,10,9,2,4,2,4,4,4,4,1,4,3,3,4,6,3,5,5,5,3,4,4,1,7,7,2,5,1,6,7,1,1,2,1,1,1,1,1,4,1,7,2,5,4,1,1,1,7,1,7,6,1,To see the end of Trumpism.,To have enough money to last me for the rest of my life.,To have a simpler life.,To avoid Doctors.,For my health to be good enough to avoid Doctors.,6,7,7,6,7,4 years,20 years,25 years,8 years,3 years,5,6,2,6,6,5,6,3,4,4,5,6,4,4,4,1,,,,,,,,,,,,,,,,,,,,,,,,
5bc5552a23ecbb00012d6cb5,,,,38,6,1,7,7,7,7,6,4,1,7,7,1,1,1,4,1,2,1,1,1,1,1,2,5,7,1,7,4,4,1,1,1,7,1,1,1,2,7,5,1,2,7,7,1,7,5,1,1,5,3,1,Pay off debt,retire,travel,find peace,age gracefully,6,7,7,7,6,1 year,3 years,3 years,20 years,20 years,2,2,5,3,5,7,7,7,6,6,7,7,7,7,7,1,husband's medical procedures,applied for medicare,took out loan,21,97,65,7,5,6,7,7,7,Changed political party I'm registered in,talked about consequences of election,fly Trump flag,90,63,100,7,6,7,7,7,7
566a19b57da035000fb39b89,32,1,3,48,6,5,4,1,6,6,5,5,6,6,5,1,2,1,1,2,1,1,3,1,2,1,4,1,5,1,2,1,5,6,5,6,5,5,6,7,6,1,1,1,1,6,5,5,5,4,4,1,1,1,1,Financial Security,Finding purpose,Finding another job,Marriage,Traveling,7,7,7,5,6,10,5,2,3,7,1,1,4,1,1,4,4,6,5,6,4,4,7,4,6,1,New gym equipment,New computer monitor,New food recipe,80,71,75,6,4,4,2,2,5,Joe Biden son,Donald Trump town hall,Nancy Pelosi meltdown on CNN,0,70,100,7,5,4,7,5,6
5e01451c6e8aabd0d17df3a9,40,1,10,50,7,1,7,7,7,7,2,7,6,7,7,1,1,1,4,1,1,1,4,1,1,6,4,1,2,1,4,3,3,1,1,4,1,1,4,1,3,1,6,5,1,5,1,3,2,4,6,2,1,3,6,Buy a house,Build my career,Spend more time with family,Exercise ,voluneer more,7,7,7,7,7,6,6,6,6,6,6,5,5,5,6,7,7,7,6,6,7,6,6,6,6,6,none,none,none,0,0,0,1,1,1,1,1,1,Kamala Harris lied during the vice presidential debate,Stimulus check delay by Mancy Pelosi,confirming Judge Barret,13,20,16,5,5,5,5,6,6
5de33dabc22a30362e4450a5,59,2,6,11,0,1,5,5,5,4,6,6,2,6,3,4,4,1,1,1,1,1,1,1,1,2,1,2,3,4,1,1,6,1,1,1,5,1,1,7,2,1,5,6,2,6,1,1,1,1,1,3,1,1,1,To stop smoking,To spend more time with my mother.,To start eating a little healthier.,To save some money.,To stop procrastinating so much.,7,4,5,7,7,10 years at least.,Just now.,About a couple of months.,About a year.,"So long, that I can't remember.",5,5,6,6,5,7,6,6,7,6,7,6,6,6,5,1,"The virus, can't really go anywhere.",Went to my son's to babysit my grandson.,I went grocery shopping with my mom on Thursday.,2,100,60,6,7,5,7,6,5,I don't have any.  Don't watch the news.,,,89,,,5,,,1,,
5dc9f3a0e2633171257d503e,,,,0,10,7,6,6,7,4,6,7,7,7,6,1,1,1,1,1,1,7,1,1,1,1,4,1,4,7,7,1,6,1,1,1,1,1,1,1,1,7,7,7,4,7,4,4,1,6,7,4,7,7,1, going on a cruise  ,retiring , fishing trip ,50th marriage celebrating ,spending time with the family,6,7,7,7,7,one year,two years,five month,eight month,five month,6,7,7,7,7,5,7,7,7,7,7,7,7,7,7,1,church meeting,shopping,walking,100,100,100,7,6,7,7,7,7,debate ,voting ,tweets ,18,100,25,5,7,2,7,7,4
56849d528f456f000c45e1dd,,,,46,0,4,5,5,5,6,6,6,5,6,6,1,1,1,1,1,1,1,1,1,1,7,1,1,5,4,1,1,5,2,1,1,1,1,1,1,6,1,1,6,6,7,1,6,1,4,5,1,1,1,1,Move to a new state,Work more hours,Work more side jobs,Create a forum to help people form helpful life skills,Create a great video game,7,7,7,6,5,1 year,6 months,1 year,6 months,3 years,7,7,6,7,4,7,7,6,6,4,7,7,7,6,7,4,I was able to earn a good amount of money,I successfully saved money for emergencies,I met great new people,100,89,100,6,7,6,7,4,7,I requested a copy of my voter registration,I read information about the election,I watched the debate between trump and biden,92,50,50,7,6,4,7,6,4
57ce74a271536c00015f12ed,,,,30,7,,,,,,,,,,,,,,,,,,,,,,,,,,,,,,,,,,,,,,,,,,,,,,,,,,,,,,,,,,,,,,,,,,,,,,,,,,,,,,,,,,,,,,,,,,,,,,,,,,,,,,,,,
5d9b8094193fe5031a42e0b4,,,,50,7,3,4,3,7,5,6,7,3,7,2,2,1,5,2,5,4,3,2,2,2,1,,1,1,,5,1,6,1,1,1,1,1,1,1,4,4,7,6,1,7,7,1,1,3,4,4,4,4,1,stay healthy,be financially secure ,see my children get married,hold my grandchild,visit ireland,7,7,7,7,7,forever,forever,forever,forever,forever,2,2,1,1,,4,4,2,2,1,4,4,4,4,4,1,got up in the morning,ate,went to bed at night,100,100,,7,7,7,7,7,7,,,,,,,,,,,,
5d88dcb723dfcc00151fd043,,,,85,7,4,4,6,7,5,7,7,5,7,6,1,1,1,1,1,1,1,1,1,1,1,7,4,4,1,7,4,1,1,1,1,1,1,1,1,7,7,4,4,7,7,7,1,1,4,1,4,7,4,1,Building up our business,Renovating our home,Taking time for myself,Volunteering,,7,4,7,7,,10 years,1 year,ongoing,ongoing,,7,5,7,4,,4,7,7,5,,7,7,7,7,,1,Visited family,Spent time with friends,Yardwork,100,100,50,7,7,4,7,7,7,talked to friends about election,watched debates,listen to talk show regarding election,45,50,50,7,5,5,7,7,7
5ca2d3dd010c73001606b7d8,43,2,7,56,3,2,6,3,5,4,4,5,2,6,6,2,2,3,4,3,4,4,2,2,3,1,6,2,3,5,2,2,3,7,7,7,7,6,7,7,3,2,7,4,2,6,2,6,6,2,2,4,2,4,1,Educate my children,Be a good parent,Start a new career,Volunteer part-time,Be a good Christian,5,6,2,3,7,12 years,15 years,1 year,10 years,20 years,1,1,3,1,1,4,1,4,4,1,7,4,6,7,4,1,Met with principal of my child's school,Met with my child's teacher,Held outdoor church service in our yard,40,10,67,4,5,4,7,7,4,Watched presidential debate,Watched VP debate,Voted by mail,59,68,93,2,3,6,7,7,7
5d5b74c1fe8768000131db67,25,2,7,13,7,4,7,6,7,6,6,7,4,6,6,2,2,2,2,2,2,2,2,2,2,2,5,4,3,3,2,2,2,3,4,4,4,3,1,3,2,2,1,3,3,4,1,3,2,2,4,4,2,2,2,Finish graduate school,Get married,Own a house,Get a dog,Travel the world,7,6,6,6,7,2 years,2 years,1 year,4 years,10 years,3,1,1,2,1,7,6,4,6,4,7,7,7,7,6,1,Went for a walk,Hiked Franconia Ridge,Made ravioli,72,65,50,3,5,2,2,7,3,Voted early,Helped texting campaign,Talked about the news,91,68,34,6,4,3,6,3,2
598ba20f716a2c000187ce01,49,1,3,17,8,3,6,3,6,5,4,6,1,6,5,2,3,5,2,4,4,2,2,2,2,1,3,1,4,1,3,2,5,1,1,1,1,1,1,1,1,3,4,4,1,5,2,1,2,2,2,2,6,4,1,get a job in software development,have savings enough to retire,take a vacation next year (if no COVID-19),have money enough to have Christmas this year.,lose 100 lbs over the next few years.,7,6,4,6,5,5 years,15 years,4 months,1 month,2 years,4,1,1,6,1,6,3,6,7,4,6,5,6,7,5,2,Fixed the hood of my truck.,Bought clothes for my child.,Took more time to look at open jobs.,80,89,56,3,5,6,4,5,3,watched part of the first presidential debate,actively watch news about election and mail-in ballots.,voted during the early voting period in my state.,9,50,100,3,4,7,2,2,7
5c101f812a1a620001f04007,66,2,9,100,9,6,6,5,7,7,7,7,6,7,7,1,1,1,1,1,1,1,1,1,1,1,1,7,6,1,7,1,2,1,1,1,1,1,1,1,7,7,7,3,7,7,7,1,1,7,2,6,4,1,1,Lose weight,Get out of debt,Save money,Move out of the state I live in,Spend more time with family,7,7,7,7,7,5 years,3 years,10 years, 10 years,10 years,7,6,6,1,6,7,7,7,7,7,7,7,7,7,7,1,Vacation to Texas,My birthday party,Quit smoking,100,100,100,7,6,7,7,7,7,Watched the debates,Spoke to people about the choices I have made,Supported a candidate financially,50,90,100,7,7,6,7,6,4
5bebd4111296920001d55c5a,36,2,6,15,6,5,6,4,6,6,5,6,6,6,6,3,2,2,3,3,5,2,4,2,2,1,7,2,1,2,1,5,5,1,2,5,1,2,1,1,1,4,2,3,1,4,4,2,1,2,5,1,5,1,1,pay student debt,increase retirement savings,increase emergency savings,get a better job,move to a new house,7,6,7,6,5,5 years,2 years,1 year,1 year,1 year,1,3,5,3,2,2,6,7,7,6,6,7,7,7,7,1,went to a concert of live music,went to dinner with my boyfriend and friends,played trivia,85,90,90,3,5,3,6,6,5,watched the presidential debate,watched the VP debate,made bets on Predictit,80,80,85,6,5,3,7,7,7
599de70d8a6cc5000128f980,31,2,8,17,8,4,6,5,7,6,6,6,6,7,6,1,1,1,3,1,1,1,1,1,1,1,3,2,1,4,,1,6,1,1,1,6,1,1,1,4,5,1,5,2,4,2,1,1,2,5,2,6,,1,start a business,get married,start a family,donate time to charity,adopt a pet,6,5,6,3,4,5,10,10,3,1,2,1,1,5,5,6,5,4,6,6,5,5,6,6,7,1,birth of a child's friend,change in job description at work,got a new roof on my house,99,73,82,7,7,6,7,7,7,I registered to vote, I paid attention to the candidates,I ordered my mail in ballot,72,45,75,7,6,7,7,7,7
5bfadc1846911f0001d7d1eb,22,1,2,0,8,3,4,3,7,3,4,6,1,7,3,5,3,6,2,3,4,1,5,2,3,1,7,3,3,3,1,7,7,1,2,2,1,1,1,1,1,4,1,7,5,5,1,1,1,1,7,4,7,6,1,get a better job,get married,have kids,go back to college,stop being lazy,7,5,6,5,4,3 years,3 years,3 years,1 year,4 years,3,2,1,6,5,6,6,5,7,6,7,6,6,7,6,1,bought tickets for a concert that happens a year from now,made plans to go back to school next year,planned a friend's birthday party,96,85,81,3,6,5,7,7,6,I debated my friends about Trump vs Biden,I considered voting early,I considered voting independent,28,66,76,3,7,6,5,4,4
