597d572d99bd880001772d8e,50,1,8,10,9,6,6,3,6,6,7,7,7,7,6,2,1,1,4,2,5,1,3,1,2,1,7,4,4,2,4,7,7,1,1,1,1,1,1,1,4,7,1,7,4,6,6,1,1,1,7,4,4,4,1,Keep my family and friends safe from covid-19,Pay off my debt.,Become a martial arts instructor.,Reconnect with friends I've lost touch with.,Help people in need.,7,7,7,7,7,8 months,2 years,18 months,6 months,30 years,6,6,1,5,7,7,7,7,7,7,7,7,7,7,7,1,I graduated to the advanced level of Krav Maga(self defense) training.,A friend of mine got married.,We got a new puppy.,100,100,100,7,7,7,7,7,7,I voted,I argued with a friend about the competence of the current president.,I watched the presidential debate.,100,0,25,7,4,4,7,7,4
59235471e937bd0001ca0245,22,2,0,50,3,2,5,7,6,7,7,7,2,7,7,6,7,3,1,3,2,1,2,1,1,2,1,1,1,4,1,1,7,1,1,1,7,1,1,1,1,4,1,4,1,4,1,1,7,1,7,1,7,1,3,Be Happy,Find a good career,Be financially stable,Keep good control of my diabetes,Find a life partner,7,6,7,7,7,Since I was a kid,Since I was a kid,Since graduating high school,Since I was diagnosed at the age of 10,A couple of years,1,2,1,3,1,4,4,3,5,2,4,4,4,4,4,2,Wisdom teeth started bothering me,I'm getting closer to my weight goal,I caught up with some shows and books,0,100,100,7,7,3,7,5,7,I've been doing research on candidates,Preparing to vote,Paying more attention to current events,50,50,50,7,7,7,7,7,7
59c843b646f72100019067ce,49,2,1,0,7,3,6,5,6,5,5,6,2,6,6,2,2,1,2,3,3,1,2,1,2,1,7,4,1,4,2,4,5,6,7,7,4,4,7,7,2,4,5,6,3,6,5,4,2,7,6,1,6,6,1,go grocery shopping,make a dental appointment,call a relative,check my bank account,pay a bill,6,6,5,6,6,5 days,2 months,7 days,7 days,6 days,7,7,7,7,7,7,7,7,7,7,7,7,7,7,7,1,I had a lab work done.,I bought a new cell phone.,I read an autobiography.,50,92,100,7,6,2,7,7,7,I voted.,I watched political news shows.,I watched clips of the debates.,100,72,20,7,4,2,7,4,4
574eab79c18847000e071119,39,2,0,70,6,5,5,7,6,4,6,6,1,6,3,3,2,3,1,2,4,1,3,2,4,1,1,5,6,1,1,1,7,1,1,1,1,2,1,1,6,6,7,3,4,7,5,1,1,1,3,2,5,4,2,Pay off student loans,Buy a car,Get fibroid removed or shrunken,Lose weight,Have more sources of income,4,7,7,6,6,10 years,5 years,3 years,2 years,4 years,1,1,3,6,4,5,7,6,7,6,7,7,7,7,7,1,I tried the yoni pearls for the first time.,I started to drink more fruit smoothies on a regular basis.,I bought a hands free headset on ebay last week.,70,100,100,6,6,5,7,4,3,I watched the Presidential Debate,I watched the Vice Presidential Debate,I watched the reacted version of the Presidential debate on SNL,30,40,100,6,5,1,7,2,7
570b8aa8b9b52b00102d97f2,67,2,8,95,10,4,7,5,7,7,6,7,6,7,7,1,1,1,5,1,2,1,1,1,1,2,7,7,7,6,7,7,4,7,6,7,7,7,7,6,6,7,7,4,7,7,7,6,7,6,6,6,6,2,1,Waking up each morning,Being fair with my employees,Being loyal to my country,Keeping my friends,Being thankful for God,6,7,7,6,7,Lifetime,20 years,Lifetime,Lifetime,Lifetime,7,6,7,7,7,7,7,7,6,7,7,6,7,6,7,1,My pastor's wife died of the COVID-19 virus,I've had to call in multiple substitute in-home nursing caregivers,I've started working on a new quilt,0,0,100,6,7,6,7,7,7,I watched the first presidential debate,I watch the Democratic second debate/Townhall,I watched the Republican second debate/Townhall,90,10,100,7,5,7,6,2,6
5dc59aea37023940a0860dea,52,1,6,40,7,5,4,4,5,5,6,6,4,5,4,3,2,4,4,3,4,2,1,2,2,1,4,1,1,2,1,2,5,1,1,1,6,1,1,1,1,4,2,4,2,2,2,1,1,3,7,1,3,1,1,FinancialfFreedom ,Launching creative endeavor,Writing more,"Taking care of house, people, pets",Taking better care of myself,7,5,5,7,6,"Long time, but becoming more important recently",3-4 years,Recently,Whole life,Recently,3,5,6,7,5,6,5,5,7,7,4,4,5,6,6,1,Helped someone with a big move.,"Had a big, unique car problem that took a few months to fix. It was weird.","Spent a day taking a relative to a few doctor appointments. Sounds routine, but I don't usually do it for this person and it ended up being a whole day + dinner and was a good day.",75,65,90,6,4,7,7,6,7,Watched the first Presidential debate.,Went back and forth between Trump and Biden Town Halls.,Received application for mail-in vote.,10,60,80,5,5,7,7,6,4
5c8eb16ed169ac0001c27629,67,2,7,40,10,4,6,6,7,6,5,6,4,7,6,1,1,1,2,2,1,3,1,1,1,1,7,4,2,3,1,7,7,7,7,4,7,7,7,7,6,7,1,4,1,6,4,1,1,1,7,7,7,4,1,Survival,Paint interior of home,remodel kitchen,remodel bathroom,travel,7,5,6,5,7,Forever,6 months,1 year,1 year,10 months,7,6,4,4,4,7,7,7,7,7,7,7,7,7,7,2,My next door neighbor of 23 years passed away,Grocery shopping,Maintained household,0,50,50,7,4,4,7,1,1,Reguested mail-in ballot,Filled out ballot,Dropped ballot off at election office,100,100,100,7,7,7,7,7,7
5dd4189ef30aa640b4e9c094,55,1,9,,9,6,6,6,7,6,6,6,4,7,4,5,1,1,2,1,3,2,1,1,2,1,1,1,4,1,1,1,7,1,1,1,1,1,1,1,1,3,1,1,6,7,1,1,1,1,1,1,1,1,1,Go paddling more than one more time this year.,Get the bridge built at the big hole.,Make the perimeter trail bike and 4-wheeler passable.,Build small shelters connected by perimeter and other trails.,Build bike trails across and down the ridge.,6,7,7,7,6,A couple of weeks.,A few months.,Many years.,Years.,Years.,6,4,3,1,1,7,7,7,5,5,7,7,7,7,6,1,"Went camping, hiking and kayaking down east.",Slaughtered and butchered the roosters.,Recovered the greenhouse.,100,90,90,6,7,6,7,7,7,Trumps childish/dictator/bully-ish behavior at the first debate.,RGB's death,Trump's supreme court super spreader event.,9,0,9,2,7,2,7,7,7
5a791168f49c9a0001f31061,42,1,9,24,9,7,5,7,6,6,7,6,6,5,6,1,2,1,1,1,1,1,2,1,1,3,1,5,7,1,1,7,6,5,1,1,1,1,1,1,1,1,1,7,5,1,4,1,1,1,1,1,6,1,3,Exercise every single day by bicycling and/or walking.,Eating nutritionally dense foods.,Riding my bicycle across the USA on the Trans America Trail.,"Practice proper sleep hygiene for my spiritual, mental and physical health.",Stay away from negative and toxic people.,7,6,7,7,7,2 years,4 years,6 months,1 month,1 year,7,7,6,7,6,7,7,7,7,6,7,7,7,7,6,2,I went to Jeju Sauna. It is a Korean Traditional Bath House Spa.,I rode my bike to 44 miles roundtrip to eat two chicken sandwiches for a market research company.,I found $71 on the ground. ,100,100,100,7,6,6,7,7,7,I watched parts of the Trump and Biden debate.,I watched parts of the Pence and Harris debate.,I watched parts of Trump speaking about COVID-19 at a political rally.,39,60,60,6,6,1,2,1,5
55b645bbfdf99b1c02906873,53,1,0,22,3,2,6,7,6,5,5,6,1,6,3,3,1,5,1,2,5,1,2,1,4,1,1,1,2,1,1,1,6,1,1,1,1,1,1,1,6,6,1,6,6,1,4,1,1,2,6,2,6,1,1,regain health,new career,loving partner,establish foundations,respected in work,7,6,7,5,5,16 years,16 years,35 years,27 years,36 years,1,2,1,1,1,6,6,3,2,2,6,5,3,4,4,1,made an actor smile,renewed lease,replenished food supply,100,87,88,5,7,7,7,6,6,found voting by mail not possible,disgust for candidates,news of Trump getting covid,0,0,12,7,5,2,7,7,3
5dd37d08c6588f38120fb465,47,2,4,5,9,5,6,5,5,6,6,5,3,6,4,3,2,3,4,3,4,4,3,1,1,2,6,6,5,7,6,7,7,7,6,4,7,7,7,7,1,1,4,7,6,1,1,4,2,4,7,6,7,3,1,Publish book,Learn Spanish,Start traveling again,"Create charity, nonprofit or fund",,7,5,7,6,,All adult life,Most of adult life,Last year,Last 10 years,,1,3,5,3,,5,5,7,5,,7,7,7,6,,1,Death of pet,Wildfires near home,Started new volunteer work,0,0,100,6,5,4,7,7,7,Volunteered to text voters,Made donations,Read daily about election,100,100,20,5,5,4,7,7,7
5d506e6d4040a40016bb186a,74,1,5,11,6,4,5,6,6,6,5,5,3,6,6,3,1,4,1,1,5,2,1,1,1,1,3,2,1,2,1,5,6,1,1,1,2,1,1,1,4,2,1,4,1,3,1,1,1,1,5,3,5,5,1,peace of mind,vacation,stop spending on some people,better health,stable finances,7,,,6,,15 years,1 year,15 years,5 years,5 years,,,,,,,,,,,,,,,,3,fell off ladder,injured foot,visited state park,8,24,89,3,3,6,6,6,6,voted,watched debate,watched town hall,100,0,87,7,,,7,7,
5de1986c040f531f97eb6092,34,1,7,50,9,5,7,6,7,7,7,7,5,7,7,1,1,1,1,1,1,1,1,1,1,1,7,7,6,2,1,1,7,7,7,7,7,6,7,7,3,5,7,3,4,7,6,7,7,2,7,1,7,2,1,Buy a house in 2021,Get a new job in 2021,Get a girlfriend in 2021,Pass my computer certification test in December,Max out my Roth IRA,7,7,6,7,5,6+ months,1 year,1 year,6 months,3 months,7,7,7,7,5,7,7,7,7,7,7,7,7,7,7,1,Losing weight,Getting orthodontic treatment,Donating to charity,100,100,100,6,7,6,7,7,6,Voting at the booth,Watching the debates,Coronavirus response,90,60,40,7,2,6,5,1,7
55abb1a5fdf99b501fab62e3,77,1,10,10,10,4,7,7,7,7,7,7,7,7,7,1,1,1,1,1,1,1,1,1,1,1,7,7,1,7,1,1,7,7,7,7,7,7,7,7,4,5,7,6,4,,5,1,1,5,7,7,7,4,1,retire,avoid contracting COVID-19,maintaining independent living ,maintaining healthy lifestyle,continuing meditation practice,7,7,7,7,7,5 years,8 months,5 years,25 years,10 years,1,5,7,7,7,7,6,7,7,,7,6,7,7,7,1,volunteered at a food pantry,took a neighbor to the emergency room (not COVID-19 related),worked remotely from home,100,100,100,7,7,7,7,7,7,watched Presidential debate,helped neighbor request absentee ballot,determined location for early voting,90,100,100,6,7,7,7,7,7
5d1a7bb2339da6001a12b11a,66,2,7,10,7,5,6,7,6,5,5,6,7,6,4,2,2,1,4,4,1,1,1,1,3,1,6,4,5,2,5,5,5,7,7,4,7,7,7,7,3,2,6,6,5,4,5,2,4,4,5,4,4,5,1,Pay off credit card debt,Finish earning my Pilot's License,Grow my own greens,Find a better source of income,Repair my house,7,6,4,6,7,13 years,8 years,7 months,8 years,8 years,1,1,6,4,1,1,3,7,7,4,6,5,7,7,6,1,My potato harvest was a failure,I achieved a personal scoring goal in a skill game,I planted lettuce and other greens and they're already sprouting!,30,100,100,4,5,6,7,7,7,I watched the debates,I studied the ballot for my area,I verified that I'm still registered to vote,39,50,83,5,6,7,7,7,7
5c1f02a310677f0001da17b8,63,2,7,9,10,4,6,4,7,7,6,7,5,7,7,1,1,1,1,1,1,1,1,1,1,1,7,7,1,4,4,7,7,7,7,7,7,7,7,7,5,4,1,7,7,4,4,7,5,7,7,7,7,7,1,Relocate to a different state,Go back to college,Start a non-profit,,,7,6,7,,,1 year,1 year,2 years,,,7,4,7,,,7,7,7,,,7,7,7,,,1,Began volunteering,,,100,,,7,,,7,,,Get the message out to vote,,,100,,,7,,,7,,
5bddd64b48428800013061a6,39,1,3,38,8,5,5,6,7,6,4,5,4,6,5,2,2,1,5,2,5,2,1,1,3,1,4,5,1,5,1,3,4,6,6,7,4,6,6,7,4,4,5,4,4,5,5,3,5,4,1,4,1,5,1,reach my investment goal,travel the world,buy a home,marry my girlfriend one day,build and maintain muscle,7,7,5,6,6,3 years,5 years,1 year,1 year,1 year,1,1,1,1,6,7,7,6,5,7,7,7,6,6,7,1,i visited an old friend,i visited my girlfriend (long distance),i saw my grandmother on her birthday,100,100,95,6,7,5,6,7,5,a friend talked to me about the debates,i watched a youtube review of the debates,i read an argument between two people on twitter about the candidates,39,50,11,2,1,1,4,2,1
5c2b4b959f18a9000179a141,24,1,5,38,3,4,4,6,4,4,3,2,2,5,3,4,3,3,4,6,5,5,4,4,4,3,5,3,3,2,4,1,4,5,2,3,4,3,4,5,3,3,2,2,5,3,4,4,3,4,3,1,2,2,2,be successful,be happy,drop a music project,keep working,live life,7,7,6,6,7,lifetime,lifetime,lifetime,lifetime,lifetime,2,2,4,5,2,4,4,6,5,4,5,5,6,5,5,3,I made music,I watched tennis,I watched baseball,80,75,68,6,5,4,6,5,3,I did not watch the first debate,I will not watch the second debate,We are screwed either way,80,82,82,6,5,6,3,3,5
5d615f7632cfbd001b1b6dcb,71,1,9,80,9,4,5,4,6,6,6,6,3,7,7,1,1,3,1,1,1,3,1,1,1,1,7,6,6,1,1,6,3,1,1,1,1,1,1,1,5,5,6,4,7,7,6,6,6,7,3,5,1,1,1,save money each year,run a 10K,be kind to my neighbors,help K.,enjoy life,6,5,6,7,6,50 years,5 years,20 years,5 years,60 years,5,2,6,7,6,7,7,7,7,7,7,7,7,7,7,3,Covid restrictions lifted where I live,Swimming more,Stock market way up,100,100,100,7,6,6,7,6,5,Biden came out of basement,Biden family grifters,Trump got and got over Covid quickly,8,0,100,2,7,7,2,7,7
5e1f8fbfb202032c463f3e06,59,2,9,100,8,1,7,7,7,7,6,6,4,7,6,1,1,1,4,1,1,1,1,1,1,1,7,4,7,7,,7,1,7,6,7,7,5,6,7,5,7,7,2,6,7,7,7,7,5,1,6,3,5,1,organize my closet,finish the book I'm writing,buy a new laptop,buy a new tablet,go to Europe,4,7,6,6,6,1 year,9 months,6 months,1 month,20 years,5,5,6,7,1,7,7,7,7,4,7,7,7,7,4,1,started new work project,went out to dinner,went to park,100,100,100,5,3,2,7,5,4,texted with family about election,read news about election,prayed that Trump would win,100,30,100,4,4,7,7,7,7
5d36600685d1d50001affacb,51,1,0,,4,3,5,7,7,4,7,7,6,6,3,5,1,3,4,4,4,1,7,3,4,3,1,1,1,1,1,1,1,6,1,1,1,5,1,1,1,1,1,1,1,1,1,1,1,1,1,7,1,1,1,Pay off debt,Find a new job,Get a gf,Run more games,Organize house,7,7,7,6,5,several years,six months,4.5 years,a few weeks,six months,1,6,3,5,4,4,7,7,7,7,5,7,7,7,7,1,Went to visit my parents' graves,Paid Keera do to some artwork,Got a new TV,82,100,100,4,5,5,7,7,7,read articles on debate,rolled eyes,did not thing else,0,0,0,1,1,1,7,6,1
5dcec32a367c6d000a4282c2,67,1,3,,1,3,6,6,6,7,5,5,3,6,5,2,2,1,2,3,5,2,4,1,1,1,1,1,1,1,1,1,7,1,1,4,1,1,1,1,1,1,1,1,1,1,1,1,1,1,1,1,7,4,1,Prepare for the journey,Provide for my family,Not get wiped out by the economy,Get through the day,Learn about the neuroscience of psychedelics,6,6,4,5,4,4 years,35 years,40 years,5 years,45 years,2,3,4,7,5,6,5,5,4,6,2,3,4,3,6,1,Watched tennis tournament,Traded stock in Chinese electric car,Got through the day,81,89,50,4,5,6,4,5,1,Got into argument with democrat,got into argument with republican,Got into argument with christian,10,20,0,2,2,6,3,2,7
5dceca2541afe801a32e27ac,76,2,8,25,8,4,5,4,6,7,7,6,4,6,5,2,1,2,5,2,2,2,1,1,3,2,3,6,5,3,1,2,7,6,4,1,4,4,2,7,1,2,6,2,4,4,1,2,1,3,5,5,5,1,1,To Survive Covid-19,To Move Into a senior resident apartment,To be alive when my son is released from incarceration,To interact more with the younger member of my family,To show My gratitude for my friends and family every day.,7,6,7,7,7,Since March 2020,Since April 2020,Since 1990,Since 2006 ,Since March 2020,5,6,4,7,7,4,7,5,7,7,3,7,6,7,7,2,Childhood friend died from the virus.,Have not seen close friends or family since March.,Four residents in my building have tested positive for the virus.,0,10,0,5,6,7,7,7,7,I forgot to renew my driver's license.,I made a new friend in my apartment building.,I ventured out to the grocery story instead of having everything delivered.,20,85,100,5,6,7,7,7,7
5996dbbc05a0e30001f1fd4a,41,1,6,63,5,6,6,6,6,5,6,6,6,6,7,5,1,2,5,1,1,1,1,2,1,4,7,5,5,5,6,5,7,4,7,6,5,2,5,7,5,5,2,6,4,5,5,6,6,2,7,3,7,2,5,to garden,to excersice,to learn a new language,,,6,6,6,,,2 years,1 years,2 years,,,5,6,5,,,6,5,6,,,6,6,5,,,7,lost retirement,less working hours,,18,7,,6,6,,7,6,,voted,,,91,,,7,,,5,,
5d16badb7b0154001a282fdb,65,2,7,20,10,4,5,7,7,6,7,7,5,7,5,2,1,1,2,6,1,1,2,1,2,1,7,6,3,2,3,4,7,1,1,1,1,1,1,1,6,4,6,5,2,7,6,1,1,7,7,3,7,4,1,Retirement,Keeping a healthy lifestyle,Traveling,,,7,7,5,,,20 years,35 years,40 years,,,1,6,1,,,7,7,7,,,7,7,7,,,4,COVID-19 Pandemic,Unable to visit with friends and family,Making improvements to my home,0,0,25,7,7,7,7,7,7,Trump contracted the virus,I voted,I'm very upset with the false information and misconceptions about the virus the President is telling.,50,100,0,4,7,7,7,7,7
5c365b5e8821900001b3876c,60,2,0,10,9,4,7,7,7,7,7,7,7,7,6,1,1,1,4,1,1,1,1,1,1,1,7,4,1,6,1,1,5,1,1,1,5,1,2,1,4,4,1,6,1,3,4,1,5,2,7,4,7,7,1,helping my sister,talking to my kids,helping my husband,helping my friend,saving the environment,7,7,7,7,7,10 years,10 years,15 years,10 years,all my life,4,4,4,4,4,4,4,4,4,4,4,4,4,4,4,1,my aunt was hospitalized with cancer,my aunt had surgery and then was taken to hospice,My aunt died day before yesterday,0,0,0,7,7,7,7,7,7,Trump got Covid,Coney Barrett was nominated for the Supreme Court,Trump refuses to wear a mask,0,0,0,7,7,7,7,7,7
5dd2c9f2c925a82e5167ef8b,58,1,9,50,8,4,5,4,7,6,7,7,1,6,6,1,1,2,1,1,1,1,1,1,1,1,1,1,1,1,1,4,6,1,1,1,4,1,1,1,4,3,1,1,4,5,1,1,4,1,5,4,4,4,1,Retirement,Travel,Growing my own food,Health,Having a business,6,4,6,7,4,10 years,2 years,20 years,30 years,5 years,1,2,4,6,2,7,4,6,6,4,7,4,6,6,4,1,Bought some gardening equipment,Began a workout routine,worked remotely,90,91,79,7,7,6,5,6,7,Covid 19,Climate change,Higher cost of living,0,0,0,7,7,7,7,7,7
5df02b4e9800ec094e120d26,19,2,3,21,9,3,5,7,5,4,7,4,3,5,3,7,2,7,3,3,4,1,7,1,2,7,7,,7,4,1,,7,7,7,,7,1,,7,4,4,7,4,7,,4,1,1,7,1,7,7,1,7,Make money,Take care of familg,Travel,Have kids,Leave generational wealth ,7,7,7,7,7,19 ,19 ,16,3,19,7,7,1,1,1,5,7,,1,1,7,7,5,7,2,1,College,Work ,Covid ,0,50,0,7,7,7,7,4,7,College ,Work ,Covid ,0,,0,7,7,7,7,5,7
5d1c4b76ab2b52001a30eeb8,21,2,4,12,4,2,3,2,6,5,3,6,1,6,1,2,2,3,5,3,2,1,2,2,1,1,2,1,1,,,1,4,1,1,4,1,1,1,,,1,1,1,1,1,1,1,1,1,1,1,,1,1,Buy a house,Own a opossum,Move to a different state,Go to and graduate college,Get married ,7,5,7,7,5,2 years ,5 years ,1 year,5 years ,2 years ,1,1,1,1,1,6,4,7,6,6,7,6,7,6,7,1,Paid off large debt,5 and half year anniversary,None,65,98,0,4,6,1,6,7,1,None,None,None,0,0,0,1,1,1,1,1,1
5dd32432e0b21b3472c20ebe,42,2,8,28,6,3,6,3,7,7,7,7,4,7,4,1,1,3,3,1,1,1,2,1,1,1,1,1,1,1,1,1,4,1,1,1,1,1,1,1,1,1,2,1,1,1,1,1,2,1,1,3,1,1,1,finish MBA,Get a promotion,Buy another house,travel to Europe,Vacation in Hawaii,7,7,6,4,5,15 years,7 years,3 years,20 years,18 years,7,6,5,1,1,7,7,7,7,7,7,7,7,6,6,1,Mother in law had a stroke,Uncle died,Aunt died,0,0,0,7,7,7,7,7,7,son registered to vote,verified voter registration for husband,verified my own registration,100,100,100,7,6,6,7,7,7
5e1efdb3a8c111230db526ff,53,1,4,81,6,3,3,4,4,5,5,4,3,5,5,3,2,4,2,3,4,1,2,2,1,2,4,1,2,4,2,1,2,1,1,4,1,3,1,1,3,1,4,5,4,6,3,1,1,2,5,4,1,1,1,responsible,healthy,positive,sociable,independent,6,5,5,4,6,20 years,3 years,3 years,3 years,3years,1,4,7,7,4,7,7,6,6,6,6,6,4,4,4,1,active,habits,relationship,79,35,35,6,6,7,5,2,7,taxes,friends,arguments,18,50,67,7,6,4,5,6,2
5e0e60798205265be682850e,44,1,6,,3,3,5,4,5,4,4,4,2,4,5,3,4,3,3,3,3,4,3,3,3,3,3,3,3,3,3,3,4,6,5,4,4,5,5,6,3,3,3,3,3,5,3,4,4,3,2,2,2,2,2,Save Money,Learn New Skills,Stay Healthy,Read Many Books,Help Family,3,4,5,5,5,a few years,several years,several years,many years,many years,1,1,1,1,1,3,4,3,3,3,4,6,1,6,6,3,Wrote a story.,Read a few books.,Started going back to the gym again.,75,55,60,5,3,4,6,5,4,Received ballot in the mail.,Talked to family about the election.,Read about the election in the newspaper.,50,40,40,1,2,2,2,3,3
5e1797da928b15062260e30e,69,1,4,52,5,5,5,5,6,7,5,5,4,6,6,1,1,3,4,2,4,1,1,2,4,2,5,7,5,1,7,1,6,1,1,1,1,1,1,1,4,5,4,3,3,7,7,1,1,5,6,2,6,1,1,Supplemental income source,Furnace repair,Paint bathtub,Sell a domain,Fill out ballot,7,6,5,6,7,Years,Just today,Months,One week,Three days,4,6,7,6,7,6,7,7,7,7,6,7,7,6,7,3,High winds causing red alerts in my city,Terrible Forrest fires in my state,Spike in COVID-19 cases in my county,0,0,0,6,7,7,5,7,6,Trump hospitalized for COVID-19,Trump rips off mask in white house after release,Trump refuses to debate Biden virtually,0,0,0,7,6,5,7,7,7
5c3630c83ce2c8000111b504,62,2,9,22,9,4,6,6,7,7,6,6,4,6,5,1,1,1,1,1,2,1,1,1,1,1,,1,1,,,1,,1,,1,,1,,1,,,1,1,,,,1,,,1,,,,1,improve my health,engage in my community,travel more,,,7,7,6,,,25 years,2 years,10 years,,,6,6,5,,,6,6,6,,,6,6,6,,,1,traveled less due to pandemic,spent less time with family,took short trip,11,11,87,6,6,7,6,6,6,voted by mail,watched debates,,100,29,,7,2,,7,2,
59417543c768a500011c9731,27,2,8,15,8,3,6,5,5,6,6,5,4,7,3,2,1,3,3,3,4,2,2,2,2,2,6,7,1,5,1,6,5,7,6,6,7,5,6,6,5,3,4,6,5,2,2,3,3,2,2,5,5,4,1,Get a new job,Get a puppy,Marry my fiance,Buy a house,Have kids,6,6,7,5,6,1 year,3 years,1 year,3 years,3 years,5,4,2,1,1,7,7,7,5,6,7,7,7,6,7,2,Interviewed for a position I am interested in,Hired a wedding photographer,Bought new running shoes,65,85,60,6,6,2,7,7,2,Looked up my polling place,Saw pro-Biden advertisement with Cindy McCain endorsing Joe Biden,Watched Presidential debate,50,70,45,6,5,4,5,6,5
5d012930cfeb82001817c9c9,29,2,7,44,6,1,2,1,2,2,2,2,3,2,2,1,5,4,4,5,5,5,4,5,5,4,4,4,5,4,5,4,5,5,4,5,4,5,4,5,4,4,5,4,4,5,5,4,3,4,4,4,3,3,5,buy a house,get promoted,find happiness,get married,get stocks,5,5,4,5,5,3 years,2 years,5 years,2 years,2 years,5,5,4,4,5,5,4,5,4,5,5,4,5,4,5,4,got promoted,went hiking ,moved,66,68,55,4,5,4,4,4,4,watched presidential debate,watched VP debate,read articles,55,55,54,5,5,4,4,4,4
5e2bf2153a9311222d4892c6,20,1,10,0,8,7,7,7,7,7,7,7,7,7,7,1,1,1,1,1,1,1,1,1,1,1,6,4,7,7,2,1,7,1,1,1,1,1,1,1,1,2,7,1,1,1,1,4,1,1,4,1,4,1,1,Finishing College,Getting Into Graduate School,Having a Big Family,Having A Big Mansion for my whole family,Getting my dream car,7,7,7,7,7,Forever,Forever,Forever,Forever,Forever,1,1,1,1,1,7,6,1,1,1,7,7,7,7,7,1,Getting Into college,Got a job ,Got Fired,100,100,0,7,7,7,7,7,7,I reistered to vote for the running office member,I voted for that,I prepared for the election,100,100,100,7,7,7,7,7,7
5cba50bf114fa5001aac5570,68,1,7,88,9,4,6,7,7,3,3,4,1,6,1,5,1,2,5,5,5,5,2,3,2,1,2,2,7,1,6,1,7,1,1,2,2,1,1,1,7,5,1,4,6,2,7,1,1,6,1,5,4,1,1,Developing chicken breeds,avoiding homelessness,ridding self of skin cancer,keep scooter running,love my animals,7,7,7,7,7,11 years,48 years,10 years,5 years,10 years,7,6,2,5,7,7,4,2,3,7,7,3,2,3,7,1,sold roosters,bought microphone,bought clogs,100,100,100,7,6,5,7,7,7,watching rally in my town today,shared memes on social media,created memes,100,100,100,6,6,6,7,6,6
5de1ef4ecb1b08240f97671a,27,1,8,14,8,5,5,5,5,5,5,5,5,5,5,2,2,2,3,2,4,4,1,1,3,2,3,4,2,1,1,1,5,2,5,2,4,1,2,4,2,3,2,4,4,3,2,3,4,5,2,4,5,6,1,Promotion at work,Grow investment fund by 20%,Pay off house,Kickstart regimented workout routine,Reduce junk food consumption,6,5,3,6,5,6 months,1 year,1 year,3 months,1 month,4,2,2,6,5,6,7,4,6,5,7,7,6,7,5,2,Leading large project at work,Sold old vehicle,Lost weight,72,88,90,6,3,5,6,7,6,Decided definitively to vote for Biden,Watched Vice President debate,Researched stimulus proposals between both parties,60,77,66,6,5,4,6,4,2
59c86f966a287600011c393e,51,1,3,15,7,5,6,6,6,6,4,5,4,6,5,2,3,2,1,3,3,2,1,1,3,1,5,5,6,5,2,5,6,6,5,2,6,4,5,5,6,6,2,5,5,5,3,2,2,3,7,4,5,4,1,Stay healthy,Eat well,Maintain good relations with family,Improve income,Secure good health care,7,7,6,6,7,33 years,41 years,lifelong,4 years,27 years,5,6,5,5,4,5,6,5,5,5,6,6,5,6,6,1,Signed new Lease for my apartment,Participated in biometrics research study,Made first payment on my long term installment (self employment) tax payment plan,90,85,100,7,7,7,7,7,7,Listened to first Presidential Debate on NPR,Listened to Vice Presidential Debate on NPR,Received mail in ballot to vote in upcoming Presidential Election,20,74,100,6,6,7,7,6,7
5dd6d370194e486498e13ab6,45,2,8,0,5,2,3,1,5,4,4,5,2,5,2,4,4,6,4,5,3,3,5,3,2,1,6,7,2,2,1,2,7,6,2,5,2,2,2,4,6,1,1,6,2,1,1,4,4,7,2,7,2,1,1,Saving money to retire,Selling my house,Buying a Tesla,Sewing a blouse,Traveling to Europe,7,7,6,6,6,20 years,10 years,5 years,2 years,20 years,1,1,1,5,1,1,6,7,7,1,7,7,7,7,7,1,I bought a sewing machine.,Work is sending me out of state.,A new client has hired me for work (unrelated to above).,100,80,100,3,7,7,7,7,7,Trump contracted COVID-19.,Trump and Biden debated.,Pence and Harris debated.,71,86,77,7,6,6,7,7,7
599eaf0fbfd73c00010ea24e,41,2,9,0,8,1,5,5,6,5,6,5,4,6,3,3,1,1,3,3,2,1,1,1,1,1,5,6,6,5,6,7,7,7,6,4,4,2,4,7,6,5,7,6,6,2,6,4,5,4,4,6,4,4,1,finish Masters,help family,better diet,more exercise,less stress,6,7,6,6,6,2 years,forever,5 years,5 years,4 years,1,7,5,5,2,7,7,6,6,1,7,7,6,6,2,1,Attended niece's baby shower,Grandmother having issues with healthcare,cousin gets Covid-19,100,0,0,6,7,6,7,7,7,Watched first debate,Watched Town Halls,verified registration,0,0,50,7,7,7,7,6,4
5c639bfa9fe0060001cd8103,62,1,9,,9,6,6,6,7,7,6,6,6,7,4,2,1,3,3,2,4,2,3,1,1,1,3,7,7,1,6,1,1,1,1,1,1,1,1,1,7,7,6,4,7,7,7,1,1,7,3,1,7,1,1,Stay alive,maintain debt free,enjoy life,be happy,remain healthy,7,7,7,7,7,62 years,10 years,62 years,50 years,5 years,5,6,7,5,4,1,6,7,6,2,1,7,7,6,3,3,started a home project ,had a medical procedure ,bought a camper,100,76,100,7,7,5,7,7,7,watched a debate,compared candidates ,fact checked candidates,10,100,100,6,7,7,2,7,7
5e21a34e683c2a000bd3a63c,56,2,8,0,8,2,6,4,7,7,6,6,2,7,6,1,3,2,2,1,2,1,1,2,1,1,6,7,6,6,6,6,6,7,7,5,7,5,6,7,1,2,4,6,5,2,1,4,7,4,4,4,4,4,1,Be approved for social security disability,regain financial stability,spend more time with my husband,support my daughter in her new mental health treatment,support my older child in non binary transition,6,6,6,7,7,9 months,10 months,6 months,2 month,5 months,4,4,6,6,6,4,5,7,7,7,,6,7,7,7,1,56th birthday,dental appointment,eye exam,100,70,80,5,5,5,7,7,7,Watched part of first presidential debate,planned with husband when to vote,witnessed daughter's absentee ballot,50,71,70,5,6,6,7,7,7
5d2a7c01b866ef0015b8e0a1,54,2,7,60,6,2,4,6,7,5,6,7,1,7,4,5,1,2,1,1,2,1,2,2,2,1,1,4,2,2,6,1,6,1,1,1,1,1,1,1,3,5,5,5,4,7,5,1,1,4,2,3,5,4,1,More financial security.,Weight loss.,Overcoming procrastination.,Becoming more minimalist.,"Making more time for leisure,",6,4,5,4,3,Several years.,Just recently.,Numerous years.,A few years.,Just recently.,3,3,3,4,4,5,4,3,6,5,5,5,3,5,4,1,Received stimulis payment.,Less online work available in the last 3 months.,Wearing a mask & socail distancing.,100,11,26,7,5,5,7,7,7,Watching debates.,Becoming more politically knowledgable.,Having political discussions with spouse/family & friends.,50,63,50,5,4,5,7,7,7
5c4de8f726093e000134ee6e,52,1,9,80,9,5,5,5,6,6,5,6,6,6,6,2,2,2,2,1,2,2,1,1,2,1,6,4,4,6,6,1,3,6,3,2,3,2,3,7,6,5,2,4,4,6,6,4,7,5,2,4,2,4,1,Retire,Save 2 million dollars,lose weight,get in shape,get mom walking again,6,6,5,6,7,30 years,5 years,10 years,5 years,6 months,6,6,5,6,7,5,5,4,4,5,7,6,5,6,5,1,Mom had surgery,Moved into Mom's house,Continued dealing with pandemic,58,39,31,6,6,5,7,7,7,Watched Debates,Watched Town Hall,Watched confirmation hearings,41,59,69,6,6,6,6,4,7
5a7dec1d2a842c0001fc7954,63,1,5,92,8,2,6,1,7,6,2,3,1,6,7,2,1,6,1,1,2,1,1,1,1,2,4,5,7,1,6,6,7,7,5,5,7,5,7,7,6,7,6,4,7,7,5,7,7,5,5,7,1,7,,Improve my finances,Find a suitable girlfriend,stay healthy,keep on making and saving money,,7,5,7,6,,forty years ,forty years,thirty years,twelve years,,7,2,7,7,,6,3,6,7,,7,3,7,7,,1,Finding out about a health issue,making a lot of money in the past month,finding out about my sister's cancer,100,100,5,6,7,5,7,7,7,Joe Biden definitely has dementia issues,Trump seems immune to any media criticism,The polls are so very biased against Trump,100,91,100,6,6,6,7,6,7
