prolificid,age,gender,lifesat_2,po_spectrum_scale_1,po_engaged_1,traits_1,traits_2,traits_3,traits_4,traits_5,traits_6,traits_7,traits_8,traits_9,traits_10,traits_11,traits_12,traits_13,traits_14,traits_15,traits_16,traits_17,traits_18,traits_19,traits_20,change_traits_5,values_1,values_2,values_3,values_4,values_5,values_6,values_7,values_8,values_9,values_10,values_11,values_12,values_13,values_14,values_15,values_16,values_17,values_18,values_19,values_20,values_21,values_22,values_23,values_24,values_25,values_26,values_27,values_28,change_values_4,goals_1,goals_2,goals_3,goals_4,goals_5,goal_importance_1,goal_importance_2,goal_importance_3,goal_importance_4,goal_importance_5,goal_length_1,goal_length_2,goal_length_3,goal_length_4,goal_length_5,goal_likelihood_6mo_1,goal_likelihood_6mo_2,goal_likelihood_6mo_3,goal_likelihood_6mo_4,goal_likelihood_6mo_5,goal_likelihood_5yr_1,goal_likelihood_5yr_2,goal_likelihood_5yr_3,goal_likelihood_5yr_4,goal_likelihood_5yr_5,goal_likelihood_ever_1,goal_likelihood_ever_2,goal_likelihood_ever_3,goal_likelihood_ever_4,goal_likelihood_ever_5,change_goals_4,events_unrelated_1,events_unrelated_2,events_unrelated_3,unrelated_valence_1,unrelated_valence_2,unrelated_valence_3,unrelated_importance_1,unrelated_importance_2,unrelated_importance_3,unrelated_mem_1,unrelated_mem_2,unrelated_mem_3,events_related_1,events_related_2,events_related_3,related_valence_1,related_valence_2,related_valence_3,related_importance_1,related_importance_2,related_importance_3,related_mem_1,related_mem_2,related_mem_3
5b915c9d22d85d000115c0f5,34,2,0,23,6,3,5,6,6,5,4,5,3,5,3,4,3,4,3,3,4,1,2,3,4,2,5,4,2,1,1,1,4,4,4,3,4,3,4,2,2,2,2,5,4,5,3,3,2,2,5,1,4,1,1,create artwork,open up online store,find remote work online,read more,be more active,6,5,5,5,6,1 year,3 years,1 year,1 year,1 year,5,3,5,6,3,6,5,6,6,7,7,5,6,7,7,2,dyed my hair,gone for a walk,worked online,40,65,78,3,4,6,4,4,6,voted,watched the debate,talked with family about the election,90,34,25,7,5,4,7,5,3
57d0a0bee3221e00015fe385,36,1,7,0,3,3,4,4,6,6,5,5,1,6,7,1,1,3,1,6,2,1,1,1,1,1,5,6,1,3,1,1,6,4,5,1,1,1,3,4,1,1,1,5,2,2,1,4,5,1,1,6,4,5,1,save up money for christmas,get groceries,make dinner,move to another state,go back to school,5,7,6,6,6,3 months,2 days,a few hours,3 years,5 years,7,7,7,2,2,7,7,7,2,3,7,7,7,4,4,1,car broke down,got a covid test,started rewatching twin peaks,0,42,100,5,6,7,7,4,7,watched debate,read news about trump getting covid,voted,0,100,50,1,7,4,1,1,3
5d5425e26375ef001b10b4e8,48,2,6,85,9,6,7,7,7,7,7,4,1,7,7,1,1,1,7,5,7,1,4,1,5,1,4,4,7,1,4,4,4,1,1,1,1,2,1,1,4,7,4,1,4,3,7,1,1,4,1,1,4,1,1,save money,pay off debt,self employed,dress great ,stay healthy,7,7,7,7,7,25,15,25,25,25,5,5,2,4,4,7,7,7,7,4,7,7,7,7,4,1,watch football,shop,eat,100,50,68,7,7,7,6,5,5,watching debates,covid battles,economy,0,0,50,5,5,7,3,4,4
5c6f2e7632cb70000169b490,43,2,7,29,9,7,6,5,6,7,7,7,7,7,6,1,1,1,1,1,1,1,1,1,1,1,5,3,1,1,1,1,7,7,7,1,1,1,7,7,1,4,4,1,3,7,1,1,2,4,1,7,1,1,1,lose 30 pounds,,,,,6,,,,,1 year,,,,,1,,,,,7,,,,,7,,,,,1,went to the park,took a road trip,did a survey,100,100,50,,,,3,7,1,watched cnn,,,50,,,5,,,2,,
5dd435b8370810425c2368cf,49,1,0,0,5,5,5,7,6,4,6,5,4,6,4,6,1,6,4,6,6,5,5,1,4,1,1,1,1,1,1,1,1,1,1,1,1,1,1,1,1,1,1,1,1,1,1,1,1,1,1,1,1,1,1,retire early,have a gallery opening,make a film ,build my own house,be a haven for rescue animals,4,7,7,7,7,5 years,25 years,25 years,1 year,5 years,1,1,1,1,1,1,4,4,4,4,1,7,7,6,7,1,none,none,none,0,0,0,1,1,1,1,1,1,still social distancing,going out only when necessary,protesting for BLM,50,50,50,7,7,7,7,7,7
5dcf34f64fee9907fc626f0f,72,2,2,11,10,2,7,7,7,7,7,7,7,7,7,2,1,1,4,1,5,2,2,1,1,2,7,7,7,6,3,2,6,7,7,7,7,7,7,7,5,7,4,7,7,6,6,7,7,7,7,4,5,,1,excelling at piano,learning another language,getting calmer,losing weight,making money,7,6,7,7,7,60 years,1 year,60 years,1 year,5 years,7,6,5,5,5,7,,6,6,6,7,7,7,7,6,3,i passed a kidney stone,my cancer test result was great,i got my piano tuned,0,100,100,6,7,7,7,7,7,i unfriended people on Facebook,i voted,i watched the debates,90,100,100,5,7,7,5,7,7
57e3fe4a813eb300018266eb,32,2,0,50,0,1,3,5,4,4,5,4,1,4,1,1,1,1,1,1,5,1,6,1,1,1,7,4,5,1,4,7,7,1,7,1,4,1,1,1,4,4,1,3,3,3,4,1,1,1,5,1,1,4,1,Open successful online store,Pay off debt,Get driving and a car,move out,get job,7,7,7,7,7,years,years,years,years,years,4,4,1,1,1,5,5,2,2,2,5,4,4,4,4,1,need to pay off debt,got a commission to make a crochet sweater,completed an expansion for an mmo game,20,100,100,7,7,7,7,7,7,hearing parents complaining about it,mail in ballots,ads from candidates,0,50,15,1,4,4,4,4,4
5c03217b1a20110001e979f0,43,1,6,0,9,6,5,7,5,6,6,6,4,6,4,2,2,2,2,2,3,2,2,2,1,1,1,6,1,3,1,6,6,1,1,1,1,1,1,1,1,1,1,6,1,1,1,6,6,6,3,6,6,1,1,Improving my mental health,Imporving my physical health,Expanding my audio producyion skillset,Learning to code,Traveling,7,7,5,5,6,10 years,5 years,5 years,6 years,1 year,6,6,6,5,6,6,6,7,6,6,6,6,6,6,6,1,Bicycling,Music Production,Cooking,100,96,94,6,5,6,7,7,7,Watching news,Researching the candidates,Researching the issues,61,75,66,6,7,7,6,6,7
5e1e18a526689418194b69e6,35,2,8,0,8,6,6,7,6,6,6,6,6,5,5,3,4,3,5,4,4,4,3,2,2,1,6,5,1,3,2,6,7,1,1,1,5,1,1,1,3,1,1,6,1,1,1,2,1,6,5,2,5,4,1,Purchase a home,Continued career growth,Pay off debt,European vacation,Retire by 60,6,7,7,2,3,3 years,5 years,10 years,3 years,5 years,7,7,1,1,4,7,7,6,6,4,7,7,7,7,4,3,Put an offer on a home,Spent time with old friends outdoors and socially distant,Visited my parents,85,100,100,6,7,7,7,5,4,Early voted,Watched the presidential debate ,Watched the VP debate,100,0,11,7,5,4,7,4,3
57597452e8feea0006ef8805,27,3,6,,3,5,7,7,4,6,6,4,6,5,7,2,2,1,5,4,4,5,3,1,4,2,7,1,5,2,5,7,7,6,7,1,5,3,7,6,4,3,7,5,5,1,5,6,6,6,6,7,7,2,1,Publish a book,Create a following for my educational material on alternative lifestyles,get fit again,finish my SQL course and get a better job,Restore my project vehicle,6,5,7,6,4,Since I was a child,5-10 years,2 years,6 months,1 year,1,5,7,7,1,6,7,7,7,5,7,7,7,7,5,2,Found out I've been autistic this whole time. that was a shock,Breakup,Started therapy,50,40,60,7,6,5,7,7,7,Lost an old friend because he's a pacifist centrist,nearly lost a DnD group because they're gaslighting pacifist enablers,Started exploring more marxist and boogaloo pages trying to figure out who's actually taking action.,40,30,50,3,5,4,5,6,4
5dd9ebd239bca1962e17e64c,48,2,9,80,3,6,6,5,6,6,6,6,6,6,6,2,2,1,2,2,2,1,1,2,1,1,7,6,6,1,4,5,1,7,7,6,7,6,7,7,7,6,4,4,7,7,7,7,7,7,1,1,1,1,1,Get kids through high school an college,Look for long term employment,Pay off mortgage,Save money for retirement,Consider whereto live in the future,7,6,7,6,7,15,5,10,10 ,10,1,2,1,1,2,5,5,4,4,6,7,7,6,6,6,1,Working temp job,Daughter has new boyfriend,Husband dropped from civil lawsuit,91,80,100,6,5,7,7,7,7,Looking over ballot,Working with family on voting quesions,thinking of getting yard signs,100,100,90,7,7,6,6,6,5
5dd405ab80123f3eaae9af80,60,2,8,0,9,3,6,7,7,6,7,7,3,7,6,1,1,3,4,2,1,2,1,1,2,1,7,1,1,4,1,7,7,1,1,1,1,1,1,1,1,1,3,7,1,1,1,1,1,1,7,1,7,7,1,Pay off Debt,Improve Artwork,Stay Healthy,Be there for my children,Be a compassionate person,7,5,7,7,7,2 years,lifelong,lifelong,38 years,20 years,2,6,6,6,5,7,7,5,7,6,7,5,4,7,5,1,My artwork has sold well,I devoted a lot of time to producing art,I paid off one debt,100,95,100,7,6,7,7,7,7,I have blocked people on Facebook,I voted,I am exasperated with some people,16,100,14,2,7,2,7,7,6
58c376f9efb64f0001358464,45,2,8,100,9,5,7,4,7,7,7,7,5,7,5,1,1,1,3,1,1,1,1,1,1,1,1,1,7,1,7,2,1,1,1,1,5,1,1,1,7,1,4,1,7,7,7,1,1,4,7,3,1,2,1,Build my buisness,Find a new home,Save money,Go on vacay,Redo my bedroom ,7,7,7,5,5,1 year,1 year,6 months,6 months,1 month,5,7,7,7,7,7,7,7,7,7,7,7,7,7,7,1,Read a new book,Subscribed to a beauty box,Ordered doordash,100,100,100,4,4,4,5,5,5,The president got covid,The president campaigns ,The president refuses to wear masks ,50,51,0,1,7,7,7,5,7
5d89487b241e9c0015e25844,31,2,9,25,8,5,6,5,5,4,5,5,4,5,6,6,3,2,4,5,4,2,4,2,4,1,7,4,4,4,2,6,7,7,7,6,7,4,7,7,6,4,4,6,6,6,5,5,3,5,5,3,1,2,1,Buy a house,Do better in my career,Have a child,Get a dog,Lose weight,6,7,5,2,4,1 year,7 years,2 months,6 months,All my life!,4,5,1,2,5,7,7,7,4,4,7,7,7,5,4,1,Hiking,Reading books,Mom's birthday,80,80,90,3,3,6,5,5,7,Watching debates,Talking to my husband,Talking to my mom,20,50,50,5,6,6,7,3,3
5d6fbd3f9ba41b0018d20082,59,1,7,0,10,4,6,5,5,5,5,4,2,6,5,2,2,2,1,4,4,3,2,1,3,1,6,7,7,6,7,6,6,7,7,4,6,6,6,7,6,5,4,6,7,5,5,6,6,5,6,6,4,7,1,more stable income,better photogaphy,write,record,travel,7,6,4,4,7,20years,6 month,20 years,1 year,1 year,5,6,3,5,6,6,6,5,5,7,6,6,5,6,7,1,injure knee,played golf,went to son's house for movie,10,79,79,5,4,5,6,3,5,Trump sick,Debates cancelled,weird competing townhalls,49,18,27,5,5,6,5,5,5
5e1fa30b3285b12ce6e39fb7,45,1,7,77,7,6,5,3,6,5,6,5,6,6,5,2,1,2,2,3,3,3,2,2,3,3,1,2,3,1,1,1,3,1,1,1,1,1,1,1,4,4,1,1,4,5,4,1,1,2,1,1,2,1,3,be more successful,have a child,travel more,find a new house,learn more,6,4,4,6,7,2 years,5 years,10 years,2 years,1 year,6,2,4,5,7,7,4,6,7,7,7,2,7,7,7,2,started taking online classes,looking for a new house,looking for a new job,99,92,98,7,7,7,7,7,7,watching debates,discussions,arguments,82,83,33,6,4,4,6,3,2
58ac91c38bf22a00015b91b3,53,1,1,5,5,4,6,5,5,4,5,4,2,5,4,2,2,3,1,3,2,1,3,2,2,1,6,3,3,2,1,7,7,4,4,1,4,2,1,4,1,4,4,4,4,3,1,1,1,2,7,2,7,2,1,learn javascript,learn how to play a guitar,visit New Zealand,Manage to finish reading James Joyce's Ulysses,Successfully grow a dewy pine,5,3,4,2,5,4 years,10 years,5 years,15 years,4 years,1,1,1,1,5,3,2,1,1,7,4,1,2,2,7,1,My betta fish died,I finished playing Titan Quest,I bought a new phone,9,82,71,2,3,5,7,7,7,I voted by mail,I watched a presidential debate,I signed a petition,82,0,50,7,2,2,7,4,2
5dc1cd625fd2031344dfe43d,58,1,1,23,4,5,6,3,7,6,5,6,1,6,5,2,1,1,6,2,1,2,6,1,2,2,1,7,7,1,1,1,7,2,1,6,1,2,1,1,1,4,1,1,1,2,2,1,1,1,4,1,2,5,3,make it through december,stay married ,see things more positive,,,6,7,5,,,3 month,10 years,2 years,,,6,5,4,,,6,5,5,,,6,5,6,,,3,wife wants to get separated,virus thread is getting worse ,daily mood is getting worse,0,4,10,7,4,5,7,3,2,watching debate in disbelief ,being concerned about the outcome of the election,being concerned what trump will do if he loses ,0,20,40,7,6,6,7,5,5
5e0696dea7fba607951ae479,35,1,7,50,7,5,6,7,5,6,7,7,4,5,7,1,1,1,4,1,1,1,3,2,2,4,1,1,4,2,1,1,7,1,1,1,1,1,1,1,6,4,1,4,1,6,1,1,1,1,1,1,1,1,4,To make it to the kingdom of God of Israel,work full time online,live in peace,Have freedom ,be my own boss,7,6,7,6,6,35 years,15 years,10 years,10 years,15 years,4,7,7,7,7,4,7,7,7,7,7,7,7,7,7,1,Played basketball at a park,Donated clothes,donated shoes,95,100,99,6,7,7,7,7,7,Watched the debate with trump and biden,watched the debate with harris and pence,watched trump and biden last night,71,60,64,4,4,4,7,7,7
5cf3f7364bcc6400019d71fa,63,2,10,50,9,7,7,7,7,7,7,7,7,7,7,1,1,1,1,1,1,1,1,1,1,1,7,7,4,1,1,4,4,1,1,1,1,1,1,1,2,3,1,3,7,7,5,1,1,1,4,7,4,4,1,save,travel,new car,gardening,making will,7,7,6,7,4,45,45,5,40,1,6,2,2,7,3,7,7,7,7,7,7,7,7,7,7,1,gardening,painting,shopping online,100,100,100,7,6,5,7,7,6,visting town my today,debate,president getting virus,100,76,0,7,5,7,7,5,7
5e16c978783225c8108ef055,59,1,7,97,10,4,5,3,6,7,4,4,4,7,7,1,1,2,3,6,2,2,1,1,2,1,7,7,6,7,1,1,7,7,7,1,7,2,7,6,7,7,1,2,7,6,7,7,7,7,1,7,1,7,1,Not get infected by COVID,Get healthy,Travel again,Make more money,Live to at least age 70,7,7,6,5,7,7 months,5 years,7 Months,20 years,5 years,5,5,6,5,1,6,7,7,7,1,6,6,7,7,3,1,Medical treatment,My Birthday,Buying a new car,95,100,100,7,3,5,7,6,7,Watching the debates,Voted by mail,Donated to Trump,40,100,83,5,7,4,7,7,7
5dcea7314d51e4107516c80d,52,2,4,10,9,2,7,7,7,7,5,5,2,7,5,1,1,1,1,2,2,2,1,1,1,1,7,7,4,4,1,7,7,7,7,6,7,7,7,7,1,4,1,2,7,3,1,5,4,7,7,6,5,5,1,Prepare an already written book of poetry for publication,Start another book of poetry,Get more fit,Spend less time online,,7,7,6,4,,6 months,1 molnth,5 months,6 months,,7,7,5,6,,7,7,6,4,,7,7,5,5,,1,Mourned the death of my sister,Communicated a lot with my niece,Tried a new wine,0,70,60,7,7,1,7,7,4,Posted anti-Trump messages on Facebook,Followed The Lincoln Project on Twitter,Screamed at the TV when that moron Trump was featued,50,80,10,2,2,1,5,6,7
5b9efb73d1ff7a00013bfe84,53,2,0,0,3,3,5,4,5,1,1,2,1,2,5,7,5,6,7,7,7,7,5,5,7,1,6,1,1,7,1,7,7,1,1,1,1,1,1,1,1,1,1,7,1,1,1,2,6,1,7,4,2,4,1,outlive my mother,lose weight,pledge to wfmu,get a haircut,make a cake,7,4,7,7,2,53 years,3 years,3 weeks,1 month,1 week,4,1,7,7,4,5,3,7,7,4,5,3,7,7,4,1,got a flu shot,someone I know had a baby,celebrated my birthday,50,15,25,4,4,1,4,7,6,i voted,i watched the only presidential debate,i watched the only vice presidential debate,30,15,5,4,1,1,7,6,2
5e1fa60088eb2e2d97c4a4a7,49,2,6,17,8,3,6,5,5,5,7,6,3,6,7,2,1,1,3,3,3,1,2,2,3,1,7,6,5,5,1,2,5,7,6,5,4,4,5,6,1,2,2,6,5,5,3,2,2,4,5,1,5,4,1,Save enough money for a comfortable retirement.,Make my elderly mom's remaining years happy.,Continue to work on myself to be kinder and more giving to others.,Volunteer and help others.,Travel and see the world.,7,7,7,6,6,10 years,5 years,20 years,2 years,10 years,1,6,5,2,1,6,6,6,6,6,7,6,6,6,6,1,I have adopted a puppy.,I met up with friends I haven't seen since March.,I have begun to meditate.,92,95,83,6,5,6,7,7,7,I sent in my mail in ballot.,I donated to Joe Biden.,I watched the 1st debate and laughed at Trump.,94,82,89,7,5,3,7,7,7
5e121701dc79bd8a1a22ca99,50,2,7,89,8,3,6,5,7,6,5,7,3,6,6,1,1,1,2,1,2,1,3,1,1,1,2,3,1,1,5,1,7,1,1,1,1,1,1,1,3,6,7,2,6,7,7,1,1,6,6,3,5,1,1,Save more,Spend more time with family,Spend more time with friends,Get more organized,Have more fun,6,7,7,6,6,10 years,five years,five years,two years,one year,6,7,,6,6,7,7,7,6,7,7,7,7,6,7,2,Horse passed away,took a trip to Sedona,Hiked Pinnacle Peak mountain,0,95,92,5,6,5,7,7,6,Watched the debate,Watched Trump's townhall,watched Biden's townhall,40,44,41,5,5,5,3,4,4
5b0c65c11e55760001b96e90,47,2,5,50,2,1,6,6,6,5,6,6,1,6,6,1,1,1,2,1,1,1,1,1,1,1,1,1,1,1,1,7,7,1,1,1,1,1,1,1,1,1,1,1,7,1,1,1,1,1,1,1,1,1,1,paint the bedroom,buy a lamp,clean the pool,cook dinner,mow the lawn,4,3,4,5,4,1,1,1,1,1,5,6,7,7,7,7,7,7,7,7,7,7,7,7,7,1,cleaned the patio,vacuumed the floor,bought a blanket,100,100,100,5,5,5,5,5,7,watched the debates 1,watched the debates 2,watch TV about election,50,50,50,4,4,4,5,5,4
5c50c73cecd461000198fea1,28,1,9,80,7,6,6,5,6,7,6,4,3,7,7,2,1,3,1,4,1,4,2,1,1,1,2,4,7,6,1,2,6,6,6,7,5,1,5,5,3,6,2,2,2,2,1,5,3,4,2,4,5,2,1,Buy more property,Travel some more of the world,Save more of my salary,Learn how to invest better,Buy a second car for fun rather than commuting as a hobby,7,7,7,5,3,3 Years,6 Years,1 Year,1 Year,1 Year,1,1,7,6,1,6,6,7,7,3,7,7,7,7,7,1,I saw my family for the first time in a while due to the pandemic,I invested into a video game set up for my own leisure,I got some new assignments at work,90,85,85,7,2,5,7,5,5,I made sure to check than I am registered to vote,I started getting much more involved in the candidates and learning about the views they have,Lots of time spent watching debates and town halls and interviews,90,70,60,7,7,7,7,7,7
5858b2ca83a02d0001e38fd2,42,1,8,45,5,4,5,4,5,5,5,5,5,5,5,3,3,3,4,4,4,3,3,3,3,1,1,4,1,3,2,2,5,2,2,2,3,2,1,2,3,4,1,2,4,2,6,1,2,2,2,2,4,2,2,save more money,be more present,take more time off,get into better shape,break world records,6,5,6,6,6,16 years,2 years,10 years,10 years,2 years,4,4,4,4,5,5,5,5,5,5,4,5,5,5,4,2,covid and shit,kids went back to school,some things started to come back into my life,10,90,89,2,7,7,6,6,6,covid and shit again!,arguments with friends,arguments at work,17,16,12,5,3,3,6,7,7
5c509cad3e4c8400010ac228,36,1,10,80,8,7,5,7,7,7,7,7,7,7,7,4,1,1,1,1,1,1,1,1,1,1,1,1,7,1,1,4,7,1,1,1,1,1,1,1,7,7,5,4,5,7,7,1,1,7,1,1,4,1,1,Lose weight,Finish college,Buy a house,Get married ,Have children,7,7,7,7,7,3 months,15 years,10 years,2 years,2 years,7,2,2,2,2,7,7,7,7,7,7,7,7,7,7,1,I got COVID-19,I went to visit my girlfriend's mother,I jammed with my old bandmates,0,100,100,7,7,7,7,7,7,I watched the debates,I talked about the elections with my girlfriend,I saw campaign signs in my neighborhood,0,90,50,1,5,4,5,6,4
59f226a9d6380600018b2923,56,2,7,76,5,4,4,4,6,5,5,6,6,6,4,2,1,1,2,1,1,1,1,1,1,1,6,3,6,2,2,2,2,5,6,6,6,6,4,3,5,6,2,4,6,7,6,4,5,6,3,6,2,4,1,losing weight,becoming financially independent,working out at least 5 days a week,eating healthy,practice meditation daily,5,6,5,6,5,3 months,1 year,6 months,3 months,1 month,4,2,3,5,5,7,5,5,6,6,7,6,6,7,7,2,had the house painted,went to the casino,visited my brother ,50,92,92,4,3,5,6,7,7,watched the debate,watched the town hall with Trump and Biden,received my voting ballet in the mail ,72,60,80,4,4,6,7,7,7
5c4c7a1a9446be00017e6b4a,44,2,5,,0,1,1,1,1,1,1,1,1,1,1,1,1,1,1,1,1,1,1,1,1,1,7,1,7,1,1,1,7,7,4,1,1,1,1,4,1,1,1,1,5,5,1,1,1,1,1,1,1,1,1,living another country,visting another country,meeting my descendants,completing my family tree,losing weights,7,7,7,7,7,4,6,15,15,5,1,1,2,6,3,1,1,1,1,1,1,1,1,2,1,1,my dog has tumors,loss of hair,muscle and joint extreme pains,0,0,0,7,7,7,7,7,7,none,none,none,51,51,50,1,1,1,1,1,1
5de970024172e2000c9dacd2,61,1,5,0,8,5,6,6,7,5,6,6,5,7,4,3,3,2,1,2,2,1,2,4,3,2,1,6,4,4,1,6,6,6,7,6,6,4,4,7,1,2,1,4,6,1,4,4,4,1,5,4,7,5,1,New car,New phone,New tablet,Be vegetarian,Be more active,2,2,2,4,4,1 year,2 months,2 months,a week,three weeks,1,1,4,6,6,7,7,7,6,6,7,7,7,6,6,1,Stomach sickness,I went to the pharmacy,I ordered groceries through Instacart,0,95,100,7,7,6,7,2,2,Watched Presidential debate,Watched Vice-Presidential debate,Voted,30,66,100,1,1,7,7,7,7
5d75af57bcfd5b001b192708,65,2,8,10,9,7,6,6,6,7,6,7,7,6,5,1,1,1,3,1,1,1,1,1,1,2,6,5,1,1,2,5,7,1,1,1,1,1,1,1,6,5,2,4,5,6,5,1,1,2,6,6,5,6,1,getting out of debt,traveling,,,,7,7,,,,1 year,1year,,,,5,6,,,,7,7,,,,7,7,,,,1,my father died,i helped clean out a house,I spent time in my home town,0,10,77,7,7,7,7,7,7,answered political questions,checked to make sure i was registered to vote,found polling place,100,100,100,7,7,7,6,6,7
57509d9b363e77000695620b,67,2,8,10,8,4,6,7,7,7,6,6,6,7,6,1,1,2,3,1,2,1,1,1,1,1,4,4,7,4,4,4,7,7,7,7,7,7,7,7,4,6,5,7,6,7,7,6,6,7,7,5,7,5,1,Finish my Christmas projects,Getting house work done each day,"Eating properly, more healthy",Losing weight,exercising more,7,4,6,7,6,2 months,1 year,5 years,5 years,5 years,7,7,6,6,6,7,6,6,6,6,7,6,6,6,6,1,Kitchen counters installed,granddaughter spent 4 days,Went to the dr.,100,100,50,7,7,5,7,7,7,I voted,I gained more Twitter followers,I watched the debates,100,50,50,7,2,4,7,1,7
5e0d256753e8464d64940925,53,2,8,0,10,5,6,4,6,6,5,6,5,6,6,1,1,1,5,2,2,2,2,2,4,1,4,1,2,1,1,1,7,5,3,1,2,2,3,4,1,1,1,1,1,1,1,2,2,6,7,1,1,7,1,making sure my daughters graduate from college,ensuring the future happiness of my daughters,traveling with my daughters,taking care of my family,living a comfortable life,7,7,7,7,6,20 years,20 years,20 years,20 years,50 years,1,1,1,7,5,7,4,6,7,6,7,7,7,7,6,1,my daughters moved into an apartment in their college town,I cleaned lots of extra stuff out of the house,I learned exercises to help the pain in my back,80,100,90,6,6,7,7,4,7,I submitted my ballot for the 2020 election,I helped my daughters complete their ballots,I feel good about what the results of the election will be,100,100,100,7,7,7,7,7,7
5e206c982d3875371ce68220,46,1,5,82,10,6,4,5,7,4,7,7,4,7,2,4,1,3,1,4,4,4,4,1,4,1,7,7,7,7,1,1,4,7,7,1,7,7,7,7,4,7,2,1,1,7,7,7,7,7,1,1,1,7,1,Buy a House,Get a Luxury Car,Get Married,Make More Friends,Lose Weight,4,5,4,7,7,20 years,10 years,20 years,5 years,30 years,1,1,1,4,4,2,3,2,5,5,5,5,4,7,7,1,Chipped a tooth,Got into a car accident,Bought a treadmill,0,0,100,7,7,7,7,7,7,Found out Trump got the Coronavirus,Found out Biden may be receiving kickbacks of 50% on all children’s business deals,Found out virtual Presidential debate was cancelled,1,0,50,4,7,1,7,7,7
5e0e32ee1d4607573dc85b1f,39,2,6,45,2,7,7,7,5,6,7,7,6,7,7,2,1,1,3,2,3,3,2,1,2,1,4,4,1,2,4,1,4,7,7,3,4,4,7,7,2,5,7,7,4,7,7,5,1,2,2,1,1,2,2,finish my counseling internship,get my master's degree,move to Austin ,buy a house ,continue working on myself to improve and grow as a person and as a mother ,7,7,7,7,7,2 years ,1 year ,1 year ,5 years ,5 years ,1,1,1,1,1,7,4,6,6,7,7,7,7,7,7,1,I finished my counseling practicum,I've been seeing a new man ,I started lifting weights,100,70,100,7,5,6,7,7,7,My favorite tv shows were interrupted because presidential debates etc. were broadcast live,I was involved in a big political discussion that turned into an argument among my friends over who to vote for ,There are constant discussions about the election where good conversation used to be,0,20,44,1,1,1,7,7,5
5d9373b0e04970001ab482da,60,2,8,5,9,5,7,7,6,6,7,6,6,7,5,2,1,1,2,4,2,3,1,1,1,1,7,7,4,5,6,6,7,7,6,7,6,6,7,7,4,6,6,7,4,4,5,7,6,5,2,7,6,2,1,Becoming really good at drawing and painting,Getting more involved in my community,Doing more to protect the environment,,,7,6,7,,,10 years,5 years,15 years,,,3,5,6,,,6,7,7,,,7,7,7,,,1,I harvested a ton of peaches and apricots from the trees in my yard.,I went out for brunch with friends.,I moderated a volunteer meeting at work.,100,100,100,6,4,4,7,7,7,I watched the first presidential debate.,I watched the vice-president candidates debate.,I had an intense political discussion with my in-laws.,17,36,21,5,5,3,7,7,7
5dcef23382a527033b089d39,55,2,8,15,8,3,4,6,6,6,6,5,1,6,5,1,1,1,1,1,1,1,1,1,1,1,1,1,1,1,1,1,6,1,1,1,1,1,1,1,1,1,1,1,1,1,1,1,1,1,6,1,6,1,1,Helping my daughter's business thrive.,Expanding my hobbies.,Traveling more.,Helping my son buy his first home.,Rescuing more animals.,7,4,5,7,6,Recently,Recently,Always,Recently,Recently,7,4,1,1,2,7,6,5,5,7,7,7,7,7,7,1,Helping my daughter with her new LLC.,Remediation of water damage in my home.,My son-in-law finishing up his immigration requirements for his Green Card.,90,50,100,7,7,7,7,7,7,Keeping up with current politics.,Encouraging people to vote.,,80,80,50,7,7,4,7,7,4
59894fbbda239a0001fb8e16,60,2,2,0,8,7,4,3,5,5,5,6,5,5,5,1,1,1,1,2,1,1,1,1,1,1,6,6,6,7,1,6,7,6,1,1,6,5,6,5,1,1,1,7,1,2,3,5,1,1,6,1,7,6,1,sell my house,move to another town,buy a house,find a job,make new friends,7,7,7,7,7,5yr,5 yr,5yr,5yr,5yr,1,6,2,5,6,7,7,7,7,7,7,7,7,7,7,1,I found a place on airbnb to vacation,I went to my bank to get cash,i visited a friend at her house,93,57,86,7,6,6,7,7,7,i called the county clerk to request a mail in ballot,I got a mail in ballot and filled it out and mailed it in,i called the clerk to see if she received my ballot back.,85,78,53,7,6,7,7,7,7
5dd40277e08a363e4e006384,40,2,1,82,5,4,5,5,5,6,6,7,1,5,3,3,1,4,3,1,6,1,7,1,2,1,6,6,7,1,1,7,5,1,1,1,1,2,1,1,1,7,1,7,5,7,6,1,1,6,5,7,3,4,1,buy a car,buy a house,move out of Florida,Get a good job,be financial able to take care of my kids,3,7,7,3,7,2 years,20 years,10 years,1 year,17 years,1,1,1,1,1,7,3,5,4,4,7,7,7,5,7,1,I got sick,My oldest son went to Tenn,My car broke down,0,0,0,2,6,6,7,7,7,I decided I was a republican,I got into a fight with my friends,Lost income,82,10,0,7,3,7,7,7,7
5dfd077e3690bd03bfa91d48,53,1,9,83,9,5,5,6,5,7,7,7,6,7,7,1,1,4,1,1,1,1,3,1,7,1,1,4,6,2,5,1,1,1,1,1,1,1,1,1,1,7,7,1,7,7,7,2,1,7,1,2,7,1,1,lose weight,retire,buy corvette,more grandbabies,live to be 100,7,7,6,7,3,my whole life,my whole life,5 years,5 years,my whole life,5,1,1,1,1,7,5,4,4,1,7,7,6,6,2,1,hurricane,work from home,did yard work,34,100,100,2,6,7,7,7,2,facebook debates,watched the debate,watched election news,24,66,70,4,5,5,6,7,4
5a1cddb4087f2e0001eafb99,41,2,2,50,0,1,6,7,5,3,6,7,1,6,6,3,2,2,4,2,2,1,2,1,2,1,2,1,7,1,1,6,4,1,1,2,1,2,1,1,3,2,1,6,7,7,5,1,1,1,5,1,1,1,1,Get a car,Get a job,Get married,Move to another state,Finish college,7,5,3,3,6,1 year,2 years,6 months,1 year,2 years,4,4,3,2,2,7,7,7,7,7,7,7,7,7,7,1,Went to doctor,Met someone,Started medications,100,74,75,7,7,7,7,7,7,None,None,None,52,50,49,4,4,4,4,4,4
5e16200e9195c6c0ec0b0e92,62,2,3,34,4,1,5,5,6,3,7,6,4,7,4,4,1,2,5,6,5,4,2,1,1,1,7,7,1,1,1,6,7,1,1,1,1,1,1,1,3,4,1,5,7,2,1,1,1,1,6,1,6,1,1,Get tire fixed,Get repairs on house done,Visit family when it is safe,Earn more money,Spend less money,6,7,6,6,3,3 months,5 years,4 months,forever,always,7,5,1,5,2,7,7,7,5,5,7,7,7,4,4,1,Volunteering in COVID-19 vaccine trial,Reduced working hours by choice,Dog had leg surgery,100,100,0,7,5,7,7,4,6,Decided to vote by absentee ballot,Can't think of anything else,Can't think of anything else,81,50,50,7,4,4,7,4,4
59296fb2e8a7ff000163f033,36,1,9,61,5,5,6,6,6,5,6,6,6,6,5,3,2,2,3,2,2,2,2,2,3,2,6,5,2,2,4,2,6,2,2,3,2,2,2,1,3,3,2,5,6,4,3,2,2,3,6,5,2,2,2,kids,money,house,boat,vacation,6,6,6,5,5,3yrs,10yrs,2yrs,2yrs,1yr,4,4,2,2,6,6,6,6,6,6,6,6,6,6,6,2,got drunk,sprained my ankle,went to the lake,87,25,88,2,2,2,6,6,6,argued over politics,listened to politics,turned off the tv,15,50,32,2,2,2,4,4,4
5e29e44fd7d15a000d1a548d,36,2,0,15,8,3,4,7,7,4,6,7,3,5,2,4,3,5,1,1,1,1,4,2,1,1,1,2,1,7,1,2,7,1,1,1,1,1,1,1,4,3,3,7,4,5,1,4,3,1,7,1,7,7,1,Finish my holiday dress,Get more customers,Save for a new place,Get married,Loose weight,5,6,7,4,7,2 weeks,A year,A year,Several years,Several years,6,4,2,4,5,7,7,7,6,7,7,7,7,7,7,1,My fiance took 2 weeks of from work,I won a raffle,I threw a virtual party for my sister,100,100,100,7,1,7,7,4,7,I used mail in ballots,Been sleepless from anxiety,I got into an argument with my fiance's father,100,0,0,7,4,4,7,4,7
574ce0a57fd0ec000db73aa6,69,2,3,30,9,5,6,7,7,5,7,7,4,7,5,2,1,1,1,1,2,1,2,1,1,1,7,5,4,2,4,7,7,7,7,7,7,7,7,7,4,4,4,7,6,4,3,7,4,5,7,4,4,4,1,Moving to another state,Helping my son be happy,Making more money to live comfortably,Having a lovely garden,Traveling and seeing more of the US,7,7,7,7,5,5 years,34 years,10 years,35 years,5 years,7,7,4,6,3,7,7,7,7,5,7,7,7,7,5,1,Made more money doing paid surveys,Went out for errands with masks and social distancing,Chose a different Medicare plan,100,95,100,7,7,7,6,7,7,Watched the Presidential debate live,Kept up consistently with news coverage,Supported my candidate of choice (Joe Biden) on social media,30,75,95,4,7,5,6,7,7
