5a21b2e1e473b80001baaa09,66,1,7,88,9,5,6,3,7,6,6,6,5,7,4,2,1,2,2,1,1,1,1,1,1,1,1,4,7,1,7,2,5,1,1,1,1,1,1,1,6,7,4,3,7,7,7,1,1,6,2,1,6,1,1,pay debt,retire,health,travel,life,7,7,7,5,7,10 years,66 years,66 years,50 years,66 years,2,2,4,2,4,6,6,4,5,4,7,7,6,5,7,1,wife birthday,stayed home,wore mask,100,50,73,7,6,7,7,7,7,watched debate,watched townhall,"discussed with family, friends.",61,62,79,4,4,5,5,5,5
5d474d1fab2d280015bb0110,31,1,6,42,7,5,6,2,5,6,5,3,2,6,3,3,1,5,2,4,3,2,3,2,5,2,5,3,4,5,1,2,5,3,2,3,3,3,2,4,2,1,1,5,4,3,3,3,2,4,2,2,2,3,1,Obtain a permanent job,Specialize in a field of my profession,Join a community board,Buy a home,Invest more in stocks,6,3,2,5,6,2 months,8 months,2 months,2 years,1 year,3,2,1,2,5,7,5,3,5,6,7,5,4,6,7,3,I purchased new glasses to wear.,I hung up various artwork in my room.,I started walking and exercising more since pre-pandemic. ,78,72,86,6,6,6,6,5,4,I spoke to colleagues about current events.,I received voting ballots in the mail.,I received multiple calls and texts about the candidates in my local area. ,51,66,42,2,5,3,1,2,1
5cbe7fdb82218d00172aa4f3,61,2,9,100,9,4,6,7,7,6,6,6,5,7,4,4,1,1,3,1,3,1,1,1,1,1,7,7,7,1,7,1,4,7,7,7,7,7,1,1,7,7,7,4,7,7,7,7,7,7,4,7,7,1,1,Getting out of debit,spending more time in prayer,decluttering my home,redoing my kitchen cabinets,removing the old carpet from my home,7,7,7,5,5,2 years,always,6 months,1 month,1 month,1,7,7,5,5,7,7,7,7,7,7,7,6,7,7,3,I spend more time with my family,I watch more Christian videos,I pray more,70,100,100,7,6,7,7,7,7,Watching news about the PotUS,Praying for our president's safety & health,Talking to my youngest son about current political events,90,100,100,7,7,7,7,7,7
5e1e935be3c7191e0519b486,57,1,8,90,9,3,5,2,5,6,4,4,6,5,7,1,1,2,3,4,3,2,3,2,2,1,5,1,7,1,7,7,3,7,7,7,7,4,7,7,7,5,7,7,7,7,7,7,7,6,4,3,4,4,1,Pay off mortgage,build new garage,lose 25 lbs,,,7,5,7,,,25 years,2 years,2 years,,,1,1,1,,,7,6,4,,,7,7,6,,,1,Our Dog died,Helped my son move to Idaho,,0,50,,6,7,,7,7,,,,,0,0,0,1,1,1,1,1,1
5d4c7ac3e8ec490018b0050d,62,2,1,8,10,4,6,6,6,6,6,7,4,6,2,3,1,5,1,4,4,4,5,1,1,1,4,6,1,4,4,6,7,1,1,1,1,1,1,1,1,2,5,6,1,7,4,1,1,2,5,1,7,4,1,losing weight,getting depression under control,getting health under control,better managing chronic pain,"putting together a book with my father, daughters and my poetry",5,7,6,7,5,6 months,8 years,3 years,6 years,1 month,3,2,3,2,2,4,3,4,4,5,3,2,4,2,5,2,participated in a virtual open mic,attended virtual services with my synagogue,spent time comforting a friend on the 10 year anniversary of his girlfriend's death,82,92,50,5,6,7,7,7,7,watched the debate,watched Biden's Town hall,voted early ,20,92,100,5,6,7,7,7,7
5c0150326a0c6e00013c6068,69,1,9,82,5,5,6,6,5,6,5,5,4,6,7,6,2,3,6,5,6,6,6,4,6,2,1,5,5,1,3,4,4,1,1,1,1,3,1,1,5,3,4,1,4,4,5,,1,4,4,5,4,1,,Lose weight,learn Spanish,get closer to family,save some money,improve health,7,4,6,6,6,2 years,5 years,45 years,45 years,5 years,5,1,4,4,4,6,5,6,6,2,5,2,5,5,2,1,we had a yard sale,finally got to see a Podiatrist,started using CPAP regular,86,86,60,,,,5,6,6,sent for absentee ballot,searched online for early voting place,talked with family about candidates,73,81,64,5,5,5,5,6,4
59cc6c0246f7210001906b71,63,1,7,40,5,4,6,6,6,6,4,5,4,6,6,2,2,2,1,3,1,1,1,1,1,4,1,1,1,1,1,1,2,1,1,1,1,1,2,2,2,1,2,2,2,2,1,2,1,1,1,1,1,1,2,get good health and eyesight,make enough money,be able to travel again,learn meaningful things,build valuable skills,7,6,5,6,6,5 years,10 years,5 years,55 years,55 years,5,5,5,6,6,6,6,6,7,6,6,6,6,7,6,2,cleaned up around the house,learning about real estate,making better Leaflet maps,70,80,80,6,5,5,6,6,6,reading news about election,learning about Trump's covid,reading about Biden's progress,50,40,60,4,3,4,3,3,4
5ddef2e6929d5de6f1050f1c,59,1,8,100,10,3,6,5,6,6,6,5,5,6,7,2,1,4,4,2,3,2,1,1,2,1,1,3,2,1,3,1,1,1,7,7,7,7,7,1,7,7,7,3,7,7,5,1,1,7,1,5,1,1,1,Spread the Gospel,Prepare my students for the fture,Prepare my family for the future,Serve others,Be faithful,7,7,7,7,7,Since Jesus saved me.,Since I decided to teach.,When I became a father.,Since Jesus saved me,Raised that well,6,2,6,6,6,6,6,6,6,6,7,7,7,7,7,1,We are looking for a new pastor.,We have celebrated several birthdays.,A daughter has had health issues,50,91,21,6,5,6,6,5,6,I have read many news articles.,I have taught my students about the electoral process.,"I have discussed the race with others,",50,72,62,6,7,5,6,6,3
561d98e03d7fe8000b0f5e09,62,2,2,15,8,6,4,4,3,2,5,5,4,5,1,5,4,2,4,6,6,4,4,6,7,2,2,4,1,6,5,2,7,1,1,2,1,4,1,4,1,4,4,2,4,5,4,1,4,1,4,2,1,3,2,moving,getting married again,socializing,losing weight,being happy,6,6,7,7,7,10 years,6 years,5 years,30 years,62,3,2,7,7,3,7,6,7,7,6,6,6,7,7,6,2,bought a new chair,went to the dentist,got a car repair done,80,62,76,5,6,6,6,6,6,watched Pres debate,watched VP debate,watched Pres town halls,79,80,75,6,6,6,5,5,6
59658491b9153e0001617465,19,2,5,11,6,1,5,6,6,7,6,7,1,6,7,1,1,4,3,2,2,2,3,2,2,3,6,5,6,6,1,1,6,6,6,3,4,5,4,3,1,1,5,4,1,1,1,1,1,1,6,4,6,1,1,graduate college,get an internship,get a job,have a family,happiness,7,6,7,7,6,4 years,1 year,10 years,10 years,10 years,1,3,4,1,4,7,6,6,1,5,7,7,7,6,5,2,starting sophomore year,,,75,,,7,,,6,,,volunteering,voting,,91,91,,6,7,,6,7,
5df81cd72713055bdf02efd8,43,1,8,10,9,4,6,4,6,6,6,6,4,6,6,1,1,1,1,1,1,1,1,1,1,1,1,2,6,5,1,6,7,7,7,6,6,6,6,7,1,4,1,6,1,4,4,4,4,1,4,1,1,4,1,Save more for retirement,Travel to Southeast Asia,Start a side business,Buy a new car,Retire,7,6,6,1,7,10 years,2 years,1 year,1 month,10 years,6,1,2,4,1,7,6,6,7,1,7,7,6,7,7,1,Death of my grandfather,I started working out at my gym again,A friend in another state contracted COVID-19,0,90,0,7,5,6,7,4,7,Registered to vote,I requested an absentee ballot,My friends and I joked about Trump contracting COVID on social media,90,90,75,7,6,1,7,7,4
5d0bc7dec89042000173c1fb,48,2,7,25,5,2,4,3,6,5,4,5,3,5,5,2,2,4,2,2,2,2,3,2,2,2,4,4,1,2,2,2,6,1,1,1,1,1,1,1,3,4,1,4,1,7,2,,1,2,6,2,3,5,1,health,save money,kids education,travel,reading ,7,6,7,4,5,19,2,2,25,30,2,1,1,1,2,2,3,3,3,4,2,2,6,4,5,1,none,none,none,50,50,50,4,4,4,4,4,4,none,none,none,50,50,50,4,4,4,4,4,4
5dd9f0e719eecb97dfab7b48,44,1,7,0,8,2,7,4,7,7,7,7,2,7,4,1,1,4,1,1,4,1,1,1,1,1,6,4,2,4,1,7,7,6,6,1,7,1,5,7,4,3,1,6,1,7,1,1,4,6,7,6,7,6,1,Eat healthy,Get in shape ,Travel,Learn a new language ,Buy a new car ,7,7,5,4,2,3 years,3 years,40 years,1 year,20 years,4,2,2,1,1,5,,4,4,2,6,,3,2,1,1,Watched tv,Homeschooled child,Went shopping ,100,83,73,7,7,7,1,7,1,Voted,Debate,President getting covid 19,100,50,100,7,4,7,7,1,7
5ddd92855daaa6d095854780,36,1,4,,1,5,7,6,5,7,6,5,3,6,3,2,2,3,7,4,5,4,3,4,4,1,4,1,6,1,3,2,7,1,2,2,2,4,2,1,4,6,4,7,6,4,3,3,3,4,6,3,7,5,2,Build Home,Build Farm,Earn money from plants or livestock.,Produce my own food,Be as self sufficient as possible.,7,7,4,5,7,10 years,5 years,5 years,10 years,10 years,4,4,4,7,5,7,6,4,7,6,7,6,6,7,7,1,Started exercising more,Stored food,Harvested garden,83,72,80,6,4,5,3,4,4,Discussed with family,Followed news headlines,Listened to podcast speaking about election,52,40,54,1,1,1,1,1,1
5b15d20c444cef0001cb1153,35,1,2,7,9,3,5,7,3,4,4,4,2,3,3,2,2,2,1,3,6,2,3,3,2,1,2,6,3,2,1,1,4,1,1,1,1,1,1,1,1,1,1,3,1,1,1,6,5,6,6,3,6,6,1,Write more,Produce More,Move,Be more creative,Make more money,7,7,4,7,4,very long,very long,very long,very long,medium long,6,6,1,5,4,7,7,5,7,5,7,7,7,7,6,1,Played a new game,Learned new history,Listened to new music,93,86,100,5,4,6,7,6,7,Voted,Watched debates,Stayed informed.,100,50,78,7,4,7,7,7,7
5dd597c897405455982d1b0c,40,2,7,30,3,4,5,4,4,5,5,4,3,5,4,2,1,3,3,4,3,3,4,3,2,3,2,1,2,1,1,1,6,1,1,1,4,1,1,1,1,1,1,1,4,1,1,1,1,1,1,1,1,4,5,Grow my networth,empathic and independent kids,personal growth,create boundaries,become compassionate,6,7,7,5,4,20 years,6 years,25 years,5 years,10 years,3,2,4,4,4,4,4,4,4,4,6,4,6,4,4,2,virtual learning,short trip to Austin,meeting with inlaw,50,70,30,6,4,5,7,7,7,I voted early,we put a biden sign in our front yard,I watched the presidential debate,70,50,50,6,4,4,7,7,7
5bdc8d12b2fff7000189b6f8,69,2,6,0,9,3,5,6,7,6,6,7,4,7,6,1,1,2,1,1,1,1,3,1,1,2,7,7,7,7,1,7,7,1,1,3,7,1,1,7,5,4,1,7,7,7,5,1,1,7,7,6,7,7,1,Getting mom into nursing home,Electing Biden/Harris,Saving money,Vacation,Fix car,7,7,7,7,7,3 months,3 years,Always,2 months,Always,7,5,5,6,7,7,7,6,7,7,7,5,6,7,7,3,Moved to new apartment,Purchased area rug,Finally unpacked everything,100,100,100,7,7,7,7,6,6,voted by mail,will be poll worker,discussed politics with friends,100,100,50,7,7,4,7,7,6
5dd7052c7fb58b000eb7c09f,55,1,6,10,7,4,5,5,6,6,5,5,5,6,6,2,2,4,2,2,2,2,2,2,2,1,5,4,1,5,4,2,7,1,1,1,1,1,1,1,1,4,6,6,1,6,6,1,1,2,4,1,5,5,1,Good health,Good relationships,Debt free,Financial success,Financial independence,7,6,6,6,6,Many years,Many years,A few years,Many years,Many years,6,6,7,4,4,7,6,7,7,7,7,7,7,7,7,1,Praying,Exercising,Making donations to the needy.,100,100,100,7,6,6,7,6,6,Reading online news about the Presidential election.,Verifying voting location.,Talking about the Presidential election with family and friends.,55,90,80,5,7,6,5,4,5
5de5dba9ff87c15699804260,64,1,7,19,10,5,6,7,6,6,7,7,4,6,5,3,1,2,2,5,2,3,2,1,1,2,1,1,1,2,1,3,5,1,1,1,2,1,1,1,1,3,1,1,1,3,3,1,1,1,7,1,6,3,1,To avoid becoming infected with the corona virus.,To be able to get my home and vehicles ready for winter.,Come up with a fire evacuation plan.,Plan how to make our retirement savings last until we can collect Social Security.,Find a way to cover medical costs until we are old enough for Medicare.,7,7,7,7,7,Since January 2020.,For the past month.,For the past 2 months.,Since March when my wife lost her job.,Since March when we lost our health insurance.,3,7,7,5,2,2,7,7,3,2,2,7,7,3,2,4,More wildfires have broken out in our area.,My health has deteriorated.,I'm producing some music with my cousin (remotely).,0,0,100,7,7,5,7,7,7,My stress levels are much higher.,I'm concerned that the election will not be fair.,I'm worried more people with get infected with the virus when trying to vote in person.,0,0,0,6,7,7,6,7,5
5977e3867412f8000194e1fe,41,1,7,24,9,5,6,4,4,3,5,4,5,5,4,3,1,2,1,3,4,2,2,2,2,2,2,2,1,2,2,3,7,3,3,2,3,1,1,1,1,2,2,3,4,3,2,1,2,4,4,2,4,3,1,be a good father,professional advancement,be a good husband,support my parents,be healthier,7,5,6,4,3,3 years,15 years,7 years,10 years,15 years,1,1,1,1,1,1,4,1,2,2,5,6,5,6,3,2,Completed a professional audit,Went on a weekend trip with wife/daughter,Cooked a large meal for a few friends,65,86,85,5,4,2,3,5,5,Reviewed Chicago Judge recommendations,watched first debate,watched vp debate,20,10,28,5,4,3,1,3,2
5c3164e528d82100018160c8,41,1,1,100,1,3,7,5,7,3,5,1,3,7,7,7,1,7,6,1,1,3,1,6,1,1,1,1,7,1,7,7,1,1,1,1,7,1,1,1,7,6,7,1,5,7,7,1,1,7,1,1,1,1,1,Make more money.,Sell stuff.,Newer car.,Extra money.,New girlfriend.,7,7,7,7,7,41 years,22 years,2 years,41 years,1 week,2,4,1,5,1,1,6,7,4,7,7,1,1,4,1,2,Spending a large amout of time at home.,Saving extra money.,Watching extra television.,20,99,1,1,7,1,7,7,7,Listening to people complain.,Restrictions on everything.,Slow postal service.,0,0,0,1,1,1,7,7,7
56e6a66af6ed900006a5867c,40,1,1,71,1,3,4,5,6,3,6,6,2,6,6,2,2,3,1,2,2,2,1,3,1,1,2,2,6,2,5,1,2,2,5,2,4,1,1,1,6,3,1,1,3,7,5,6,6,4,6,5,2,1,2,Learn a new job skill,Invest money for the future,Strengthen relationship with girlfriend,Move out of home with family,Get health problems resolved,7,6,7,2,4,2 years,10 years,1 year,2 years,2 years,2,3,5,1,7,5,7,5,7,7,6,5,7,4,7,3,Traveled with girlfriend,Got health issued looked into,Met girlfriends family,100,28,82,7,6,6,7,2,6,Registered grandmother to vote,Filled out abscentee ballot for grabdmother,Argued with a friend on social media,76,78,9,5,5,2,1,2,3
5dea5ba4446c901777bde897,41,2,6,32,4,5,7,4,7,5,2,4,2,7,7,3,1,1,7,6,3,1,3,2,2,3,2,6,7,1,1,4,5,7,3,4,3,1,3,7,2,2,4,4,1,5,1,5,2,4,1,1,7,1,1,Give my child a great education,Pay the bills while staying at home with my child,Travel the world,Stay healthy into old age,Being beautiful into old age,7,7,5,7,4,For eight years,For eight years,For two decades,For two years,For two years,4,4,1,4,4,6,5,4,6,6,7,4,7,7,7,1,I won a credit card dispute against a dealership which sold me a lemon car.,I homeschooled my daughter five mornings each week.,I began packing to move home next month.,100,100,23,6,7,5,7,7,5,I voted.,I taught my daughter about the election.,I watched the Presidential debate.,80,91,0,7,7,4,7,7,3
5dcf6d762e4a050ac2cba07d,51,1,8,30,10,3,6,5,7,7,5,7,2,7,7,1,1,1,5,2,6,1,1,1,1,1,4,4,7,7,1,7,7,7,7,4,7,7,7,7,5,7,1,7,1,4,4,7,4,7,1,7,7,5,1,saving money for retirement,Completing college,quit smoking,lose weight,travel,7,3,7,7,4,5 years,15 years,25 years,3 years,30 years,1,1,4,4,1,1,4,7,7,4,7,4,7,7,7,1,BLM protest in my town,Tried CBD for the first time,Got a flu shot,20,100,100,7,4,7,7,7,7,Had argument with a Trump supporter,Researched Trumps accusations of Biden,Made political opinion posts on Reddit,10,100,100,1,7,2,7,7,1
59c0782e5364260001dc4740,57,2,6,0,10,1,7,1,7,7,7,7,1,7,7,1,1,4,1,1,1,1,1,1,1,1,4,4,4,5,4,4,4,1,1,1,1,1,1,1,4,7,7,4,4,7,7,1,4,4,4,4,1,4,1,Buying a home,Traveling,get out of debt,loose weight,enjoy life,7,4,7,7,7,2 years,1 year,3 years,1 year,1 year,1,4,1,4,4,4,7,7,7,7,4,,7,7,7,1,can not travel to visit family,death of family members,corona virus cases going up and down,21,0,0,7,7,7,7,7,7,absentee voting,listening to debates,evaluating candidates,100,50,70,7,7,7,7,7,7
56e70a4cc89073000de74a5f,71,1,3,100,10,4,5,4,7,7,7,4,7,7,7,1,1,1,4,1,4,1,1,1,1,1,1,6,6,1,7,1,2,1,1,1,1,1,1,1,6,6,6,4,7,7,7,1,1,7,4,1,6,1,1,Make more money ,get healthy ,take a vacation with my wife ,exercise more ,read more ,7,7,7,7,7,60,5,5,5,3,3,3,3,6,6,5,5,6,6,6,5,5,6,6,6,1,Got a new lift chair ,got a new walker ,bought a new computer ,96,91,100,7,7,7,7,7,7,Debate ,scandal Bidens son,Trumps  rallies ,52,9,95,5,7,7,6,6,6
5deaf334789cb321c7f002c2,53,2,4,60,7,1,7,6,7,6,6,6,1,7,4,4,2,3,6,3,6,3,3,4,5,2,1,1,7,1,1,6,4,1,1,1,1,1,1,1,6,6,1,1,1,2,6,1,1,1,2,1,6,1,1,Get out of debt,Make more money from home,Get our plumbing problems repaired,Get our siding problems repaired,Get through menopause,7,7,6,5,7,Five years,Three years,Two years,One year,Five years,1,5,3,7,1,3,7,7,7,4,7,7,7,7,7,2,Got new glasses,Started shopping for new tires,Cleaned up my desk,40,40,95,6,5,3,7,7,7,Started paying attention to early voter information,Watched the debate,Watched the news about the President's illness with COVID,60,0,40,6,3,3,7,7,7
55c43918fdf99b080551e044,32,1,5,50,8,4,4,4,7,4,4,4,4,7,5,2,2,4,1,2,4,1,3,1,1,5,5,4,1,4,1,1,3,1,1,1,1,1,1,1,3,4,5,4,4,1,1,1,1,1,4,4,7,1,5,Own a home,Have a dedicated home office,Stay healthy,Make every technical farm in Minecraft,Own a Tesla,5,6,4,4,4,5 years,5 years,32 years,1 year,2 years,1,1,4,2,1,4,4,4,4,4,4,4,4,5,4,5,Started earning more money,Learned to stop dwelling on the past or worrying about the future so much,Built a bunch of technical things in Minecraft and started to understand Redstone,80,90,90,6,7,6,1,6,6,I started to feel more neutral towards Kamala Harris rather than being skeptical,I voted by mail,"I watched a whole 2 seconds of the Presidential Debate, then didn't want to watch it anymore",50,50,0,4,4,1,1,1,1
5e164e81502213c397f0cf39,36,1,3,18,6,3,3,3,6,3,3,5,2,6,4,3,5,5,2,6,6,4,5,4,1,3,6,2,2,2,1,2,6,3,6,1,6,5,5,3,2,2,3,3,2,2,3,4,4,3,4,2,3,1,3,Ensure financial sustainability,Not contract COVID-19,Achieve true independence,Just hang in there,Find some skill I could actually use,6,7,3,7,6,2 years-ish?,Seven or eight months,Since fucking forever,I don't even know,I don't even know,3,5,1,4,4,5,6,3,4,5,4,4,3,4,4,4,Fell on and injured my hands because they somehow hit the floor faster than my ass did,Took a really big dump and became really tired,Got high from spicy snacks (just ghost pepper flavoring),20,50,90,3,2,2,5,1,4,Received mail-in ballot,Watched presidential debate,Forgot to watch vice presidential debate,80,40,50,7,3,3,4,5,5
5b233660648d5b0001b7de87,67,1,8,13,9,5,6,5,7,6,7,7,5,7,6,1,1,2,1,1,1,1,1,1,1,1,5,7,4,3,6,4,6,7,6,6,6,6,6,7,5,6,7,6,1,7,7,6,6,6,6,6,6,6,1,lose 10 pounds,exercise more,be more patient,stay focused more,read more,6,7,6,7,6,3 months,6 months,3 months,2 months,3 months,6,7,6,6,6,7,7,6,6,7,7,7,6,7,7,2,My nephews birthday,A new cable company service,harvested vegetables,100,71,100,7,6,6,7,7,6,I voted,I watched a debate,I watched a town hall,100,90,90,7,6,6,7,6,6
5be76e0505e5cd00017a1f8e,51,2,10,50,8,4,7,7,7,5,7,7,4,7,4,1,1,1,1,1,1,1,1,1,1,1,1,4,1,1,1,1,7,7,7,1,1,1,2,7,7,1,1,1,1,3,1,7,7,4,1,4,1,1,1,Quit smoking,Lose weight,Be happy,,,7,5,7,,,30 years,20 years,50 years,,,4,4,7,,,7,7,7,,,7,5,7,,,1,I finished a book.,I harvested my garden.,I visited my grandson.,100,100,100,6,7,7,7,7,7,I watched the Presidential debate.,I registered to vote.,I voted by mail.,0,100,50,5,6,4,7,7,7
58cc6e1293dac30001d4abc6,50,1,8,15,8,4,6,6,6,6,6,6,6,6,6,2,2,2,2,2,3,2,2,2,2,1,5,4,4,3,1,1,6,2,1,1,1,1,1,1,2,5,1,4,4,7,4,1,2,5,4,5,6,5,1,Limit alcohol consumption,Quit smoking,Lose weight,Buy a house,Make manager,6,7,7,7,5,10 years,10 years,2 years,15 years,6 years,6,4,7,1,2,6,6,7,4,6,6,6,7,5,6,1,Children continued remote learning for the new school year,Wife got a part-time remote job,My sister had another son,80,90,100,6,5,7,7,7,7,I voted by mail,I registered to be a poll worker,I encouraged people to vote,70,85,85,7,5,7,7,7,7
581649f0b434f0000184d2a9,27,2,5,28,7,2,4,6,6,4,5,4,2,6,6,2,1,1,2,5,4,2,2,2,2,2,6,6,4,4,3,5,5,4,5,6,2,3,4,6,2,3,5,4,6,6,4,2,3,5,5,5,2,5,1,To get married next autumn,Learn sign language,Collect more unique clothing pieces,Finish my friend's Christmas presents,Learn a new dance,6,3,4,4,2,6 months,1 year,7 years,2 months,1 month,1,4,6,7,4,7,5,4,7,6,7,5,4,7,5,1,I took pictures for my friend that graduated from a program,I experimented with new cooking recipes,I saw my dad through Zoom,96,67,50,5,2,3,7,3,4,I filled out my ballot ahead of time,I discussed early voting with my father about how to do it,I took my ballot and the ballot of my SO to the post office to be sent,77,50,66,7,6,7,6,5,7
5dd3d082ed36493b905e87dc,67,2,7,22,7,1,6,3,6,6,5,6,2,7,5,3,1,3,3,2,2,2,2,1,1,1,4,1,6,2,1,1,2,6,6,6,6,6,6,7,1,1,1,5,1,1,1,1,1,1,6,1,1,1,1,Having enough money to live on throughout my life,Set up new accounting system for SPI,Complete tracking for grants for Sierra Roots,Prepare for kids' visit next week,Lose weight before doctor's appointment,7,5,6,6,4,15 years,2 months,2 months,2 months,1 month,5,7,7,7,4,5,7,7,7,5,6,7,7,7,4,1,remodeled downstairs bathroom,friends visited from Marquette,dental work,87,60,57,5,2,6,5,3,6,voted,watched news on CNN website,researched who to vote for,56,55,56,6,4,5,5,2,2
590fbd5b4e83da0001b6fbbc,41,1,8,0,5,7,7,7,7,7,7,7,1,7,7,1,1,1,1,2,1,4,2,1,2,2,1,1,1,6,1,1,4,1,1,2,1,1,1,1,1,1,1,1,1,4,1,1,1,1,1,1,4,1,3,Pay off debt,Meditate longer,Learn spanish,Travel more,Get in shape,7,7,6,5,6,3yrs,2yrs,2yrs,5yrs,5yrs,3,6,5,6,6,6,6,6,6,6,7,7,6,6,6,2,I became isolated during covid,I lost contact with family,I raised snails from babies and sold them,41,18,78,5,5,3,5,5,5,I looked for voting sites.,I saw protest on tv,I watched debates. ,77,32,35,5,2,3,6,3,3
5e175705cfe8dc000b559793,42,1,9,50,6,6,5,6,6,5,6,6,7,7,7,6,1,1,2,3,2,2,2,2,3,1,1,1,3,1,1,1,5,2,3,1,1,1,1,1,4,3,1,2,1,6,3,4,5,1,3,1,1,1,1,save for kids college ,grow 401K,stay healthy,travel,visit family more,6,6,7,3,5,12 years,22 years,forever,forever,10 years,1,1,1,2,5,4,4,6,6,7,6,7,3,7,7,1,ran 5K,visited my grandmother,took kids to a lake,91,100,100,2,7,6,7,7,7,mask mandate,kids attending school online,presidential debate,68,56,0,4,5,6,7,7,7
5df58b28ecb3ea3ed1ceea37,25,2,8,43,7,1,6,4,7,7,7,7,7,7,5,1,1,2,1,1,5,1,1,1,1,1,3,3,1,5,1,1,6,7,2,6,6,5,6,6,1,1,3,2,3,6,2,1,5,3,2,1,1,1,1,To earn my LPC,To be married in 5 years,To build a house in 10 years,To have kids within 10 years,To move back to Pennsylvania by 2025,6,5,6,7,6,for 5 years,for 5 years,for a few months,for my whole life,for the past 3 months,1,1,1,1,1,6,4,1,1,5,7,7,7,7,7,1,Working from home,Beginning a diet,Getting serious about working out,86,90,96,6,7,7,7,2,5,voting for the election,watching the VP debate,watching the presidential debate,82,33,12,7,6,5,6,6,6
5c6fb7c3c114eb00018b3154,28,1,2,48,3,7,5,7,6,5,4,4,2,4,5,4,3,2,1,3,2,2,3,1,2,2,1,4,4,1,1,3,1,1,1,1,1,1,1,1,7,4,1,1,3,6,2,1,1,1,1,2,1,1,1,exercise at least 4 times a week,stay sane,take better care of my car,reduce alcohol consumption,be prepared for any and everything,5,7,5,6,7,3 months,forever,1 week,2 weeks,15 years,6,6,4,5,5,3,3,4,5,5,7,7,5,6,6,3,I bought a new engine for my car,I put my car in the shop,I took my dog for a walk,14,39,72,5,3,2,7,7,3,talked to my mom about it ,watched news about it,received mail bout it,50,50,50,1,1,1,5,3,2
5c261a30b15f050001cefdb4,73,2,10,15,8,4,7,5,7,7,6,6,5,7,6,1,1,1,1,1,1,1,1,1,1,1,7,2,1,1,1,1,7,1,1,4,1,1,1,1,4,6,7,4,1,6,4,2,4,1,7,4,1,7,1,Increse Net Worth annually,Maintain my weight,Meet my obligations,Help when I can,Learn new things,5,7,7,6,7,25 years,1 year,60 years,20 years,50 years,4,7,7,7,7,4,7,7,7,,4,7,7,7,7,1,Learning to tat,Taking up knitting again,Helping my sister,87,73,100,1,1,6,7,7,7,Received my Vote by Mail Ballot,Watched all the news about Trump's Covid diagnosis,Discussed what is happening with my SO,100,0,50,7,4,4,7,7,7
5c9d2bed010c73001706aeaa,69,1,9,65,7,3,5,4,7,7,4,3,5,7,6,1,1,3,1,5,5,1,4,1,1,1,2,4,4,1,7,2,6,1,1,1,1,1,1,1,6,7,2,3,7,7,7,1,2,4,7,4,6,2,1,staying in decent health,wintering in Texas or Florida,,,,7,6,,,,life long,since retirement,,,,7,7,,,,6,7,,,,6,7,,,,1,Trip to Vincennes,Week in Batesville RV park,Made profit in stock trades,100,95,100,5,6,7,7,7,7,no events,,,50,,,4,,,4,,
5995be89f9db7d0001895993,62,2,9,75,8,4,4,2,6,6,6,6,5,7,6,1,1,4,3,2,2,1,1,1,1,1,7,1,1,1,1,1,2,1,1,1,1,1,1,1,7,6,1,4,5,6,5,1,1,7,7,6,7,1,1,Retirement ,Visit as many National Parks as possible,Continue my hospice volunteering as long as possible,Spend time in Sedona AZ,"Visit France, Italy, Greece",7,6,7,7,6,10 years,20 years,5 years,5 years,5 years,7,4,6,4,4,7,7,7,7,7,7,6,7,7,7,1,my aunt died,my dad was diagnosed with dementia,my neice had a baby,0,0,100,7,7,7,7,7,7,Town Meeting,"Facebook, Twitter censored unfo about Joe Biden's son",Trump diagnosed with Covid,50,20,50,4,7,7,2,7,7
5df2f2ed4c81b2201c6c782e,71,2,7,5,9,5,6,6,6,6,7,7,2,6,5,3,2,4,5,3,6,3,6,2,2,5,7,1,1,3,3,7,7,1,1,1,7,1,1,1,1,7,1,6,3,7,2,3,3,4,7,6,7,4,1,Improving health through exercise,Improving health through diet,Repairing damage to my home,STarting a business,Moving out of state,6,6,7,7,5,About two months.,About six months,About six months.,About one year,About three months,5,6,6,6,1,7,7,7,7,5,6,6,7,7,6,2,Tree-trimming project,Getting better sleep,Noticing more self-acceptance,100,100,100,7,7,7,7,7,7,Letter-writing campaign,Text-banking & really not liking negativity received,Noticing family members reactions to election,100,70,100,7,7,7,7,7,7
578ba9442fc0d400012c71dc,23,1,4,0,10,5,7,6,5,4,6,5,3,6,6,4,2,1,1,3,2,1,3,3,1,2,7,1,1,7,1,1,7,1,1,3,1,3,1,1,5,2,4,7,2,6,1,1,1,1,7,1,7,7,1,I'd like to move out of my parents' house into a place of my own.,I want to graduate university with my bachelor's degree in business in 2022.,I'd like to be the owner or leader of a successful company. ,"I want to improve my personality and work on all my flaws, becoming the best possible person I can be.",I'd love to help my friends and family achieve their own goals and make them all happy.,7,5,4,6,4,Since mid-February 2020,"Since the day I began my first semester in university, August 24th 2020","Since mid 2019, around June",Since May 2020,Since 2017,3,1,1,5,4,6,7,3,7,6,7,7,4,7,7,1,Celebrating birthdays in the family such as my mother's and my grandfather's.,Praise from my university professors about the quality of my work in their classes.,Being hit and threatened by my father.,100,100,0,7,5,1,5,3,7,Watching the presidential and vice presidental debates live.,Researching the goals of Joe Biden and Kamala Harris.,Following news coverage of the Biden and Trump campaigns.,33,92,70,6,4,7,6,7,5
5df11e6cdc85350234932daa,37,2,9,0,8,5,6,6,7,7,7,7,6,7,6,1,1,1,2,2,2,1,2,1,1,1,5,1,1,1,1,1,3,1,1,1,6,1,1,1,1,2,7,1,4,7,2,1,2,1,4,1,1,1,1,paying off student loans,continue saving for retirement,losing weight,purchasing a new home,paying off credit card debt,7,7,7,7,7,16 years,10 years,1 years,2 years,5 years,1,1,4,1,1,7,5,7,7,7,7,7,7,7,7,1,Children began virtual schooling for the year.,Celebrated my 12 year wedding anniversary.,Celebrated my birthday.,50,100,100,7,7,7,7,7,7,Watched the Presidential debate.,Watched the Vice Presidential debate.,Attended a virtual event encourage people to vote.,0,10,90,7,7,7,1,1,6
5a8b61fcf1408d000176b02f,62,2,10,79,8,1,4,4,7,7,7,7,2,7,7,1,1,1,1,1,1,1,1,1,1,1,1,7,7,1,7,7,1,7,7,1,7,1,1,1,7,7,1,4,7,7,7,7,7,7,1,1,1,1,1,going on my cruise,visiting my new grandson,going to the grocery,getting the halloween decorations out,finish my painting,7,7,2,4,7,2 years,6 months,7 days,2 weeks,month,7,7,7,7,7,7,7,7,7,7,7,7,7,7,7,1,went to the store,went to lunch with a friend,did some Christmas shopping,100,100,100,2,4,5,1,6,4,watch a debate,watched a rally, watched a news conference,100,100,100,7,7,7,6,5,4
5e1ce181e37cd906f01b3226,65,2,9,93,3,7,7,7,6,7,7,7,5,6,6,6,6,1,5,7,4,1,6,1,4,5,1,1,4,1,6,5,6,1,1,1,1,1,1,1,4,7,7,1,1,6,7,1,1,5,1,3,1,7,2,Getting out of debt,Losing weight,Being more organized,,,7,7,7,,,10 years,15 years,5 years,,,2,2,7,,,7,6,6,,,7,7,7,,,6,Planning a wedding,Went visiting,Went pumpkin picking,100,100,100,7,7,7,7,7,7,Watched recent debates,Mailed my ballot,,84,100,,5,7,,6,7,
